Provider|Event ID|Channel|Message
Microsoft-Windows-User Device Registration|360|Microsoft-Windows-User Device Registration/Admin|{Message} Device is AAD joined ( AADJ or DJ++ ): {DeviceIsJoined} User has logged on with AAD credentials: {AADPrt} Windows Hello for Business policy is enabled: {NgcPolicyEnabled} Windows Hello for Business post-logon provisioning is enabled: {NgcPostLogonProvisioningEnabled} Local computer meets Windows hello for business hardware requirements: {NgcHardwarePolicyMet} User is not connected to the machine via Remote Desktop: {UserIsRemote} User certificate for on premise auth policy is enabled: {LogonCertRequired} Machine is governed by {MachinePolicySource} policy. See https://go.microsoft.com/fwlink/?linkid=832647 for more details.
Microsoft-Windows-User Device Registration|361|Microsoft-Windows-User Device Registration/Admin|{Message} Device is AAD joined ( AADJ or DJ++ ): {DeviceIsJoined} User has logged on with AAD credentials: {AADPrt} Windows Hello for Business policy is enabled: {NgcPolicyEnabled} Windows Hello for Business post-logon provisioning is enabled: {NgcPostLogonProvisioningEnabled} Local computer meets Windows hello for business hardware requirements: {NgcHardwarePolicyMet} User is not connected to the machine via Remote Desktop: {UserIsRemote} User certificate for on premise auth policy is enabled: {LogonCertRequired} MDM user certificate enrollment is ready: {MDMCertEnrollmentReady} Certificate enrollment method: {Message}0 See https://go.microsoft.com/fwlink/?linkid=832647 for more details
Microsoft-Windows-User Device Registration|362|Microsoft-Windows-User Device Registration/Admin|{Message} Device is AAD joined ( AADJ or DJ++ ): {DeviceIsJoined} User has logged on with AAD credentials: {AADPrt} Windows Hello for Business policy is enabled: {NgcPolicyEnabled} Windows Hello for Business post-logon provisioning is enabled: {NgcPostLogonProvisioningEnabled} Local computer meets Windows hello for business hardware requirements: {NgcHardwarePolicyMet} User is not connected to the machine via Remote Desktop: {UserIsRemote} User certificate for on premise auth policy is enabled: {LogonCertRequired} Enterprise user logon certificate enrollment endpoint is ready: {ADFSRaReady} Enterprise user logon certificate template is : {Message}0 User has successfully authenticated to the enterprise STS: {Message}1 Certificate enrollment method: {Message}2 See https://go.microsoft.com/fwlink/?linkid=832647 for more details.
Microsoft-Windows-User Device Registration|363|Microsoft-Windows-User Device Registration/Admin|The Microsoft Passport key is missing. Key ID: {KeyId} Attestation level: {AttLevel} AIK status: {AikStatus} Key type: {KeyType} Key name: {KeyName} IDP domain: {IdpDomain} Tenant ID: {TenantId} User email: {UserEmail}
Microsoft-Windows-User Device Registration|364|Microsoft-Windows-User Device Registration/Admin|The saved Microsoft Passport information does not match the key. Saved information:   Key ID: {SavedKeyId}   Key name: {SavedKeyName}   IDP domain: {SavedIdpDomain}   Tenant ID: {SavedTenantId}   User email: {SavedUserEmail} The Microsoft Passport key:   Key name: {KeyName}   IDP domain: {IdpDomain}   Tenant ID: {TenantId}   User email: {UserEmail}
Microsoft-Windows-User Device Registration|365|Microsoft-Windows-User Device Registration/Admin|Unable to enroll for a logon certificate using a Registration Authority. Automatic certificate enrollment will retry at regular intervals. UPN: {UPN} TenantId: {TenantId} ExitCode: {ExitCode}
Microsoft-Windows-User Device Registration|366|Microsoft-Windows-User Device Registration/Admin|Unable to enroll for a logon certificate using a Registration Authority. Resource: {Resource} ExitCode: {ExitCode}
Microsoft-Windows-User Device Registration|367|Microsoft-Windows-User Device Registration/Admin|Added following properties to the Web Account Manager access token request. Properties: {Properties}
Microsoft-Windows-User Device Registration|368|Microsoft-Windows-User Device Registration/Admin|The following token properties were recieved from the Web Account Manager: Properties: {Properties}
Microsoft-Windows-User Device Registration|369|Microsoft-Windows-User Device Registration/Admin|The Workstation Service logged a device registration message. Message: {Message} 
Microsoft-Windows-User Device Registration|370|Microsoft-Windows-User Device Registration/Admin|The automatic device registration task failed to unregister device.  Exit code: {ExitCode}. Server error: {ServerErrorMessage}. Debug Output:\r\n {TenantName}.
Microsoft-Windows-User Device Registration|371|Microsoft-Windows-User Device Registration/Admin|The automatic device registration task successfully unregistered device.
Microsoft-Windows-User Device Registration|372|Microsoft-Windows-User Device Registration/Admin|The FIDO credential was successfully registered with Azure AD. Credential ID: {KeyId} UPN: {UPN} Request ID: {RequestId} Time: {Time} Server response: {ServerResponse}
Microsoft-Windows-User Device Registration|373|Microsoft-Windows-User Device Registration/Admin|FIDO credential registration failed. Exit code: {ExitCode} Request ID: {RequestId} Time: {Time} HTTP status: {HttpStatus} Error code: {ErrorCode} Error subcode: {ErrorSubCode} Server error message: {ServerErrorMessage} Server response: {ServerResponse}
Microsoft-Windows-User Device Registration|374|Microsoft-Windows-User Device Registration/Admin|The FIDO credential registration request was successfully sent. RPID: {RPID} UPN: {UPN} Credential display name: {KeyDisplayName} User display name: {UserDisplayName} User image URL: {UserImageUrl} Key algorithm: {KeyAlgorithm} Auth token: {AuthToken} Request ID: {RequestId} Flags: {Flags}
Microsoft-Windows-User Device Registration|375|Microsoft-Windows-User Device Registration/Admin|The FIDO credential registration initialization operation failed. Exit code: {ExitCode} RPID: {RPID} UPN: {UPN} Credential display name: {KeyDisplayName} User display name: {UserDisplayName} User image URL: {UserImageUrl} Key algorithm: {KeyAlgorithm} Auth token: {AuthToken} Request ID: {RequestId} Flags: {ExitCode}0
Microsoft-Windows-User Device Registration|376|Microsoft-Windows-User Device Registration/Admin|The FIDO credential was successfully created. UPN: {UPN} Credential display name: {KeyDisplayName} User display name: {UserDisplayName} User image URL: {UserImageUrl} Key algorithm: {KeyAlgorithm} Auth token: {AuthToken} Request ID: {RequestId} Flags: {Flags}
Microsoft-Windows-User Device Registration|377|Microsoft-Windows-User Device Registration/Admin|Unable to create FIDO credential. Exit code: {ExitCode} UPN: {UPN} Credential display name: {KeyDisplayName} User display name: {UserDisplayName} User image URL: {UserImageUrl} Key algorithm: {KeyAlgorithm} Auth token: {AuthToken} Request ID: {RequestId} Flags: {Flags}
Microsoft-Windows-User Device Registration|378|Microsoft-Windows-User Device Registration/Admin|The FIDO credentials were successfully deleted from Azure AD. Number of credentials: {NumOfKeyIds} UPN: {UPN} Request ID: {RequestId} Time: {Time} Server response: {ServerResponse}
Microsoft-Windows-User Device Registration|379|Microsoft-Windows-User Device Registration/Admin|FIDO credential deletion failed. Exit code: {ExitCode} Request ID: {RequestId} Time: {Time} HTTP status: {HttpStatus} Error code: {ErrorCode} Error subcode: {ErrorSubCode} Server error message: {ServerErrorMessage} Server response: {ServerResponse}
Microsoft-Windows-User Device Registration|380|Microsoft-Windows-User Device Registration/Admin|The FIDO credential registration request was successfully sent. UPN: {UPN} Credential ID: {KeyId} Auth token: {AuthToken} Request ID: {RequestId}
Microsoft-Windows-User Device Registration|381|Microsoft-Windows-User Device Registration/Admin|The FIDO credential registration initialization operation failed. Exit code: {ExitCode} UPN: {UPN} Credential ID: {KeyId} Auth token: {AuthToken} Request ID: {RequestId}
Microsoft-Windows-User Device Registration|382|Microsoft-Windows-User Device Registration/Admin|Unable to parse the FIDO registration server response. HTTP status: {HttpStatus} Server response body: {ResponseBody} Error: {ErrorCode}
Microsoft-Windows-User Device Registration|383|Microsoft-Windows-User Device Registration/Admin|The PIN has been successfully recovered.
Microsoft-Windows-User Device Registration|384|Microsoft-Windows-User Device Registration/Admin|The PIN recover operation failed with exit code: {ExitCode}.
Microsoft-Windows-User Device Registration|385|Microsoft-Windows-User Device Registration/Admin|Unable to get attestation statement for Microsoft Passport key. Key name: {KeyName},  KeyStatus: {KeyStatus} ({KeyStatusSymbolicName}), Error: {ErrorCode}.
Microsoft-Windows-User Device Registration|386|Microsoft-Windows-User Device Registration/Admin|Successfully got attestation statement for Microsoft Passport key. Key name: {KeyName}, KeyStatus: {KeyStatus} ({KeyStatusSymbolicName}). 
Microsoft-Windows-User Device Registration|387|Microsoft-Windows-User Device Registration/Admin|Unable to reset registry recovery flag. Error: {ExitCode}
Microsoft-Windows-User Device Registration|388|Microsoft-Windows-User Device Registration/Admin|Recovery API {APIName} called. Error: {ExitCode}
Microsoft-Windows-User Device Registration|500|Microsoft-Windows-User Device Registration/Debug|{Message}
Microsoft-Windows-User Device Registration|501|Microsoft-Windows-User Device Registration/Debug|{Message}
Microsoft-Windows-User Device Registration|502|Microsoft-Windows-User Device Registration/Debug|{Message}
Microsoft-Windows-User Device Registration|503|Microsoft-Windows-User Device Registration/Debug|{Message}
Microsoft-Windows-User Device Registration|504|Microsoft-Windows-User Device Registration/Debug|{Message}
Microsoft-Windows-User Device Registration|4096|Microsoft-Windows-User Device Registration/Admin|The automatic device registration task will be triggered.
