Event ID,Event Version,Level,Channel,Task,Opcode,Keyword,Windows,Version,Edition,Date,Build,Event Message,Event Fields
4500,0,Information,System,,,,Windows 11,24H2,Pro,2024/10/2,26100.1742,Starting Windows Recovery Environment servicing.,
4501,0,Information,System,,,,Windows 11,24H2,Pro,2024/10/2,26100.1742,Servicing succeeded. The Windows Recovery Environment version is now: {Version},{Version}
4502,0,Critical,System,,,,Windows 11,24H2,Pro,2024/10/2,26100.1742,Windows Recovery Environment servicing failed.,
4503,0,Critical,System,,,,Windows 11,24H2,Pro,2024/10/2,26100.1742,Windows Recovery Environment servicing cancelled.,
4504,0,Information,System,,,,Windows 11,24H2,Pro,2024/10/2,26100.1742,Changes to Windows Recovery Environment have been rolled back.,
