Event ID,Event Version,Level,Channel,Task,Opcode,Keyword,Windows,Version,Edition,Date,Build,Event Message,Event Fields
2001,0,,,,,,Windows Server 2008R2,SP1,Standard,2011/02/09,7601,The DNS server is now booting from the registry or directory. The existing server boot file will no longer be read by the DNS server at startup. For any new zones that you add or for changes you make to zone information; you must make them using the DNS console. The previous DNS server boot file has been moved to the %SystemRoot%\System32\Dns\backup directory. To return to using a boot file; use the DNS console and reconfigure the boot method for the server.  For more information; see 'To change the boot method used by the DNS server' in the online Help.,
1073741826,0,,,,,,Windows Server 2008R2,SP1,Standard,2011/02/09,7601,The DNS server has started.,
1073741827,0,,,,,,Windows Server 2008R2,SP1,Standard,2011/02/09,7601,The DNS server has shut down.,
1073741828,0,,,,,,Windows Server 2008R2,SP1,Standard,2011/02/09,7601,The DNS server has finished the background loading of zones. All zones are now available for DNS updates and zone transfers; as allowed by their individual zone configuration.,
1073742532,0,,,,,,Windows Server 2008R2,SP1,Standard,2011/02/09,7601,The DNS server did not detect any zones of either primary or secondary type during initialization. It will not be authoritative for any zones; and it will run as a caching-only server until a zone is loaded manually or by Active Directory replication. For more information; see the online Help.,
1073742533,0,,,,,,Windows Server 2008R2,SP1,Standard,2011/02/09,7601,The DNS server has moved the AD-integrated root hint data for all DNS servers in this domain to the {param1} directory partition.,{param1}
1073742534,0,,,,,,Windows Server 2008R2,SP1,Standard,2011/02/09,7601,An administrator has changed the type and zone storage options of zone {param1}. The zone is now type {param2}. The zone will be stored in the zone file {param3}.,{param1} | {param2} | {param3}
1073742535,0,,,,,,Windows Server 2008R2,SP1,Standard,2011/02/09,7601,An administrator has changed the type and/or Active Directory location of zone {param1}. The zone is now type {param2}. The zone will be stored in Active Directory at {param3}.,{param1} | {param2} | {param3}
1073742536,0,,,,,,Windows Server 2008R2,SP1,Standard,2011/02/09,7601,An administrator has changed the zone storage options for zone {param1}. The zone will now be stored in the zone file {param2}.,{param1} | {param2}
1073742537,0,,,,,,Windows Server 2008R2,SP1,Standard,2011/02/09,7601,An administrator has moved the zone {param1} to a new location in Active Directory. The zone will be stored in Active Directory at {param2}.,{param1} | {param2}
1073742624,0,,,,,,Windows Server 2008R2,SP1,Standard,2011/02/09,7601,The zone {param1} is configured to accept updates but the A record for the primary server in the zone's SOA record is not available on this DNS server. This may indicate a configuration problem. If the address of the primary server for the zone cannot  be resolved DNS clients will be unable to locate a server to accept updates for this zone. This will cause DNS clients to be unable to perform DNS updates.,{param1}
1073743826,0,,,,,,Windows Server 2008R2,SP1,Standard,2011/02/09,7601,The DNS server has written a new version of the boot file.  Either new zones or changes to existing zone information were made through the DNS console that required the DNS server to update the information in this file.  A copy of the previous boot file has been moved to the %SystemRoot%\System32\Dns\backup directory.,
1073743829,0,,,,,,Windows Server 2008R2,SP1,Standard,2011/02/09,7601,The DNS server has been reconfigured to boot from a boot file.  Current server and zone configuration information has been written to this file. To return to booting from the registry or Active Directory; use the DNS console and reconfigure the boot method for the server.  For more information; see 'To change the boot method used by the DNS server' in the online Help.,
1073744325,0,,,,,,Windows Server 2008R2,SP1,Standard,2011/02/09,7601,The DNS server has completed a scavenging cycle: Visited Zones     = {param1}; Visited Nodes     = {param2}; Scavenged Nodes   = {param3}; Scavenged Records = {param4}.  This cycle took {param5} seconds.  The next scavenging cycle is scheduled to run in {param6} hours.  The event data will contain the error code if there was an error during the scavenging cycle.,{param1} | {param2} | {param3} | {param4} | {param5} | {param6}
1073744326,0,,,,,,Windows Server 2008R2,SP1,Standard,2011/02/09,7601,The DNS server has completed a scavenging cycle but no nodes were visited. Possible causes of this condition include:    1) No zones are configured for scavenging by this server.   2) A scavenging cycle was performed within the last {param1} minutes.   3) An error occurred during scavenging.  The next scavenging cycle is scheduled to run in {param2} hours.  The event data will contain the error code if there was an error during the scavenging cycle.,{param1} | {param2}
1073744455,0,,,,,,Windows Server 2008R2,SP1,Standard,2011/02/09,7601,The DNS server successfully autoconfigured: 	{param1} 	{param2} 	{param3} 	{param4},{param1} | {param2} | {param3} | {param4}
1073744974,0,,,,,,Windows Server 2008R2,SP1,Standard,2011/02/09,7601,The DNS server wrote version {param1} of zone {param2} to file {param3}.,{param1} | {param2} | {param3}
1073745829,0,,,,,,Windows Server 2008R2,SP1,Standard,2011/02/09,7601,The DNS server received indication that zone {param1} was deleted from the Active Directory.  Since this zone was an Active Directory integrated zone; it has been deleted from the DNS server.,{param1}
1073745844,0,,,,,,Windows Server 2008R2,SP1,Standard,2011/02/09,7601,The DNS server is now starting to load zone {param1} in the background. While the zone is being loaded all DNS updates and zone transfer requests will be refused.,{param1}
1073745845,0,,,,,,Windows Server 2008R2,SP1,Standard,2011/02/09,7601,The DNS server has completed background loading of zone {param1}. The zone is now available for updates and zone transfers if allowed by the zone's configuration. It took {param2} seconds to load the zone.,{param1} | {param2}
1073746324,0,,,,,,Windows Server 2008R2,SP1,Standard,2011/02/09,7601,The DNS Application Directory Partition {param1} was created. The distinguished name of the root of this Directory Partition is {param2}.,{param1} | {param2}
1073746325,0,,,,,,Windows Server 2008R2,SP1,Standard,2011/02/09,7601,The DNS Application Directory Partition {param1} was deleted. The distinguished name of the root of this Directory Partition was {param2}.,{param1} | {param2}
1073746326,0,,,,,,Windows Server 2008R2,SP1,Standard,2011/02/09,7601,The DNS added the local Active Directory to the replication scope of Application  Directory Partition {param1}. The distinguished name of the root of this Directory Partition is {param2}.,{param1} | {param2}
1073746327,0,,,,,,Windows Server 2008R2,SP1,Standard,2011/02/09,7601,The DNS removed the local Active Directory from the replication scope of Application  Directory Partition {param1}. The distinguished name of the root of this Directory Partition is {param2}.,{param1} | {param2}
1073746337,0,,,,,,Windows Server 2008R2,SP1,Standard,2011/02/09,7601,The DNS server detected that it is not enlisted in the replication scope of the directory partition {param1}. This prevents the zones that should be replicated to all DNS servers in the {param2} forest from replicating to this DNS server.  To create or repair the forest-wide DNS directory partition; open the the DNS  console. Right-click the applicable DNS server; and then click 'Create Default Application Directory Partitions'. Follow the instructions to create the default DNS application directory partitions. For more information; see 'To create the default DNS application directory partitions' in Help and Support.  The error was {param3}.,{param1} | {param2} | {param3}
1073746338,0,,,,,,Windows Server 2008R2,SP1,Standard,2011/02/09,7601,The DNS server detected that it is not enlisted in the replication scope of the  directory partition {param1}. This prevents the zones that should be replicated to all DNS servers in the {param2} domain from replicating to this DNS server. For information on how to add a DNS server to the replication scope of an application directory partition; please see Help and Support.  To create or repair the domain-wide DNS directory partition; open the the DNS  console. Right-click the applicable DNS server; and then click 'Create Default Application Directory Partitions'. Follow the instructions to create the default DNS application directory partitions. For more information; see 'To create the default DNS application directory partitions' in Help and Support.  The error was {param3}.,{param1} | {param2} | {param3}
1073746347,0,,,,,,Windows Server 2008R2,SP1,Standard,2011/02/09,7601,The DNS server has detected that the application directory partition {param1} is replicating onto this domain controller. DNS data will not be loaded from this new directory partition until initial replication has completed.,{param1}
1073746348,0,,,,,,Windows Server 2008R2,SP1,Standard,2011/02/09,7601,The DNS server has detected that the application directory partition {param1} has finished replicating onto this domain controller. DNS data will now be loaded from this directory partition.,{param1}
1073747324,0,,,,,,Windows Server 2008R2,SP1,Standard,2011/02/09,7601,The DNS server received a bad DNS query from {param1}.  The query was rejected or ignored. The event data contains the DNS packet.,{param1}
1073747325,0,,,,,,Windows Server 2008R2,SP1,Standard,2011/02/09,7601,The DNS server encountered a bad packet from {param1}.  Packet processing leads beyond packet length. The event data contains the DNS packet.,{param1}
1073747326,0,,,,,,Windows Server 2008R2,SP1,Standard,2011/02/09,7601,The DNS server received a bad TCP-based DNS message from {param1}.  The packet was rejected or ignored. The event data contains the DNS packet.,{param1}
1073747328,0,,,,,,Windows Server 2008R2,SP1,Standard,2011/02/09,7601,The DNS server encountered an invalid domain name in a packet from {param1}. The packet will be rejected. The event data contains the DNS packet.,{param1}
1073747329,0,,,,,,Windows Server 2008R2,SP1,Standard,2011/02/09,7601,The DNS server encountered a domain name exceeding the maximum length in the packet from {param1}. The event data contains the DNS packet.,{param1}
1073747330,0,,,,,,Windows Server 2008R2,SP1,Standard,2011/02/09,7601,The DNS server encountered an invalid domain name offset in a packet from {param1}. The event data contains the DNS packet.,{param1}
1073747331,0,,,,,,Windows Server 2008R2,SP1,Standard,2011/02/09,7601,The DNS server encountered a name offset exceeding the packet length from {param1}. The event data contains the DNS packet.,{param1}
1073747332,0,,,,,,Windows Server 2008R2,SP1,Standard,2011/02/09,7601,The DNS server encountered a packet name exceeding the maximum label count from {param1}. The event data contains the DNS packet.,{param1}
1073747333,0,,,,,,Windows Server 2008R2,SP1,Standard,2011/02/09,7601,The DNS server encountered an invalid DNS update message from {param1}.  The packet was rejected. The event data contains the DNS packet.,{param1}
1073747334,0,,,,,,Windows Server 2008R2,SP1,Standard,2011/02/09,7601,The DNS server encountered an invalid response message from {param1}.  The packet was rejected. The event data contains the DNS packet.,{param1}
1073747335,0,,,,,,Windows Server 2008R2,SP1,Standard,2011/02/09,7601,The DNS server encountered a name with a label whose length exceeds the maximum  of 63 bytes from {param1}. The event data contains the DNS packet.,{param1}
1073747824,0,,,,,,Windows Server 2008R2,SP1,Standard,2011/02/09,7601,The DNS server started transfer of version {param1} of zone {param2} to the DNS server at {param3}.,{param1} | {param2} | {param3}
1073747825,0,,,,,,Windows Server 2008R2,SP1,Standard,2011/02/09,7601,The DNS server successfully completed transfer of version {param1} of zone {param2} to the DNS server at {param3}.,{param1} | {param2} | {param3}
1073747826,0,,,,,,Windows Server 2008R2,SP1,Standard,2011/02/09,7601,The transfer of version {param1} of zone {param2} by the DNS server was aborted by the server at {param3}. To restart the transfer of the zone; you must initiate transfer at the secondary server.,{param1} | {param2} | {param3}
1073748344,0,,,,,,Windows Server 2008R2,SP1,Standard,2011/02/09,7601,Zone {param1} was updated to version {param2} of the zone as provided from the master server at {param3}.,{param1} | {param2} | {param3}
1073748345,0,,,,,,Windows Server 2008R2,SP1,Standard,2011/02/09,7601,Zone {param1} is synchronized with version {param2} of the zone as provided from the master server at {param3}.,{param1} | {param2} | {param3}
1073748346,0,,,,,,Windows Server 2008R2,SP1,Standard,2011/02/09,7601,A more recent version; version {param1} of zone {param2} was found at the DNS server at {param3}. Zone transfer is in progress.,{param1} | {param2} | {param3}
2147484057,0,,,,,,Windows Server 2008R2,SP1,Standard,2011/02/09,7601,The DNS server list of restricted interfaces contains IP addresses that are not configured for use at the server computer.  Use the DNS manager server properties; interfaces dialog; to verify and reset the IP addresses the DNS server should listen on.  For more information; see 'To restrict a DNS server to listen only on selected addresses' in the online Help.,
2147484059,0,,,,,,Windows Server 2008R2,SP1,Standard,2011/02/09,7601,The DNS server has bound one or more socket pool sockets to port numbers from port exclusion range {param1}.,{param1}
2147484062,0,,,,,,Windows Server 2008R2,SP1,Standard,2011/02/09,7601,The DNS server computer currently does not have a DNS domain name.  Its DNS name is a single-label host name with no domain (for example:  'host' rather than 'host.microsoft.com').  You might have forgotten to configure a primary DNS domain for the server computer.  Because the DNS server has only a single-label name; all zones created will have default records (SOA and NS) created using only this single-label name for the server's host name.  This can lead to incorrect and failed referrals when clients and other DNS servers use these records to locate this server by name.  To correct this problem:   1) Click Start; and then click Control Panel.  2) Open System and Maintenance ; and then open System.   3) Click Change Settings; and then click Change.  4) Click either Domain or Workgroup; and then type the name of the domain or  workgroup you want the computer to join; the domain or workgroup name will be used as your DNS domain name.   5) When prompted; restart the computer. After the computer restarts; the DNS server will attempt to fix up default records; substituting the new DNS name of this server for the old single-label name.  However; you should review the zone's SOA and NS records to ensure that they now use the correct domain name of this server.,
2147484354,0,,,,,,Windows Server 2008R2,SP1,Standard,2011/02/09,7601,The DNS server does not have a cache or other database entry for root name servers. Either the root hints file; cache.dns; or Active Directory must have at least one name server (NS) resource record; indicating a root DNS server and a corresponding host (A) resource record for that root DNS server.  Otherwise; the DNS server will be unable to contact the root DNS server on startup and will be unable to answer queries for names outside of its own authoritative zones.  To correct this problem; use the DNS console to update the server root hints.  For more information; see the online Help.,
2147484850,0,,,,,,Windows Server 2008R2,SP1,Standard,2011/02/09,7601,The DNS server encountered an unsupported 'directory' directive in the server boot file {param1} at line {param2}. All database files must be located in the '%SystemRoot%\system32\dns' directory. The directory directive is ignored.,{param1} | {param2}
2147485168,0,,,,,,Windows Server 2008R2,SP1,Standard,2011/02/09,7601,The DNS server encountered the unknown directive '{param1}' in file {param2} at line {param3}. The directive was ignored.,{param1} | {param2} | {param3}
2147485169,0,,,,,,Windows Server 2008R2,SP1,Standard,2011/02/09,7601,The DNS server encountered the unsupported directive '{param1}' in file {param2} at line {param3}. The directive was ignored.,{param1} | {param2} | {param3}
2147485170,0,,,,,,Windows Server 2008R2,SP1,Standard,2011/02/09,7601,The DNS server encountered the obsolete directive '{param1}' in file {param2} at line {param3}. The directive was ignored.,{param1} | {param2} | {param3}
2147485171,0,,,,,,Windows Server 2008R2,SP1,Standard,2011/02/09,7601,The DNS server encountered the directive '{param1}' in file {param2} at line {param3}. The directive is not yet supported and was ignored.,{param1} | {param2} | {param3}
2147485173,0,,,,,,Windows Server 2008R2,SP1,Standard,2011/02/09,7601,DNSSEC signatures with key tag {param1}; associated with records in zone {param2}; will expire on {param3} (UTC time). Once the signatures expire; name resolution will fail for resolvers that require validation  until new signatures are created.  To create new signatures; re-sign the zone.,{param1} | {param2} | {param3}
2147485249,0,,,,,,Windows Server 2008R2,SP1,Standard,2011/02/09,7601,DNS server encountered the obsolete record type {param1} in database file {param2}; line {param3}. The record was ignored.  MD or MF record types are obsolete.  They should be converted to MX record type which has the format:   MX <preference value> <mail server domain name> Example: 	microsoft.com   MX 10 mai1.microsoft.com.  For more information; see the 'Resource records reference' in the online Help.,{param1} | {param2} | {param3}
2147486278,0,,,,,,Windows Server 2008R2,SP1,Standard,2011/02/09,7601,The DNS server could not configure the network connections of this computer with the local computer's IP address as the preferred DNS server; because this computer is connected to networks with different or invalid DNS namespaces. Manual configuration of the local DNS server to perform name resolution on one or more of the namespaces is required before the preferred DNS servers of this computer should be modified.  If the network connections of this computer are not configured with the local computer's IP address as the preferred DNS server; this computer may not be able to dynamically register DC locator records in DNS. Absence of these records may prevent other Active Directory domain controllers and domain members from locating this domain controller.  User Action:  Ensure that DC locator DNS records enumerated in the file %SystemRoot%\system32\config\netlogon.dns are registered on the local DNS server. If these records are not registered in DNS: a) Add a delegation to this DNS server to parent DNS zone matching the name of the Active Directory domain OR b) Configure the local DNS server with appropriate root hints and forwarders (if necessary) and configure the network connections of this computer with the local computer's IP address as the preferred DNS server. Note that other computers using other DNS servers as their preferred or alternate DNS servers may not be able to locate this domain controller; unless the DNS infrastructure is properly configured.,
2147487661,0,,,,,,Windows Server 2008R2,SP1,Standard,2011/02/09,7601,The DNS server is waiting for Active Directory Domain Services (AD DS) to signal that the initial synchronization of the directory has been completed. The DNS server service cannot start until the initial synchronization is complete because critical DNS data might not yet be replicated onto this domain controller. If events in the AD DS event log indicate that there is a problem with DNS name resolution; consider adding the IP address of another DNS server for this domain to the DNS server list in the Internet Protocol properties of this computer. This event will be logged every two minutes until AD DS has signaled that the initial synchronization has successfully completed.,
2147487665,0,,,,,,Windows Server 2008R2,SP1,Standard,2011/02/09,7601,The DNS server was unable to load or create the DnsAdmins group. The most likely cause is that the Group Name has been changed. The DNS server will continue but for full functionality the DnsAdmins group should be repaired. The event data contains the error.,
2147487666,0,,,,,,Windows Server 2008R2,SP1,Standard,2011/02/09,7601,The DNS server was unable to begin background loading of Active Directory-integrated zones. There may be a system resource problem. The DNS server service will now terminate. The event data contains the error.,
2147487667,0,,,,,,Windows Server 2008R2,SP1,Standard,2011/02/09,7601,The DNS server attempted to load the Active Directory-integrated zone {param1} in the background but there was an error during load. This zone will now be shut down. Correct the error and restart the DNS server service. The event data contains the error.,{param1}
2147488048,0,,,,,,Windows Server 2008R2,SP1,Standard,2011/02/09,7601,The DNS server is experiencing high SOA query load. This may be caused by a large number of local client machines performing updates. Single object replication of DNS records corresponding to SOA queries is being throttled. This may delay replication of updates to this RODC DNS server; however scheduled replication will not be affected.,
2147488158,0,,,,,,Windows Server 2008R2,SP1,Standard,2011/02/09,7601,The DNS server was unable to connect to the domain naming FSMO {param1}. No modifications to Directory Partitions are possible until the FSMO server is available for LDAP connections. The event data contains the error code.,{param1}
2147488160,0,,,,,,Windows Server 2008R2,SP1,Standard,2011/02/09,7601,The DNS server was unable to create the built-in directory partition {param1}. The error was {param2}.,{param1} | {param2}
2147488163,0,,,,,,Windows Server 2008R2,SP1,Standard,2011/02/09,7601,The zone {param1} was previously loaded from the directory partition {param2} but another copy of the zone has been found in directory partition {param3}. The DNS Server will ignore this new copy of the zone. Please resolve this conflict as soon as possible.  If an administrator has moved this zone from one directory partition to another this may be a harmless transient condition. In this case; no action is necessary. The deletion of the original copy of the zone should soon replicate to this server.  If there are two copies of this zone in two different directory partitions but this is not a transient caused by a zone move operation then one of these copies should be deleted as soon as possible to resolve this conflict.  To change the replication scope of an application directory partition containing DNS zones and for more details on storing DNS zones in the application directory partitions; please see Help and Support.,{param1} | {param2} | {param3}
2147488168,0,,,,,,Windows Server 2008R2,SP1,Standard,2011/02/09,7601,The DNS server encountered error {param1} building the zone list from Active Directory. The DNS server will sleep for {param2} seconds and try again. This can be caused by high Active Directory load and may be a transient condition.,{param1} | {param2}
2147488169,0,,,,,,Windows Server 2008R2,SP1,Standard,2011/02/09,7601,The DNS server encountered error {param1} attempting to load zone {param2} from Active Directory. The DNS server will attempt to load this zone again on the next timeout cycle. This can be caused by high Active Directory load and may be a transient condition.,{param1} | {param2}
2147488170,0,,,,,,Windows Server 2008R2,SP1,Standard,2011/02/09,7601,The DNS server has deleted all records for a corrupt DNS node from Active Directory. The DNS node's distinguished name was {param1}.,{param1}
2147488699,0,,,,,,Windows Server 2008R2,SP1,Standard,2011/02/09,7601,The DNS server is using a large amount of memory.  The data is the current memory allocated.,
2147489651,0,,,,,,Windows Server 2008R2,SP1,Standard,2011/02/09,7601,The DNS server received a request from {param1} for a UDP-based transfer of the entire zone.  The request was ignored because full zone transfers must be made using TCP.,{param1}
2147489652,0,,,,,,Windows Server 2008R2,SP1,Standard,2011/02/09,7601,The DNS server received a zone transfer request from {param1} for a non-existent or non-authoritative zone {param2}.,{param1} | {param2}
2147490171,0,,,,,,Windows Server 2008R2,SP1,Standard,2011/02/09,7601,Zone {param1} failed zone refresh check.  Unable to connect to master DNS server at {param2} to receive zone transfer.  Check that the zone contains correct IP address for the master server or if network failure has occurred.  For more information; see 'To update the master server for a secondary zone' in the online Help.  If available; you can specify more than one master server in the list for this zone.,{param1} | {param2}
