Event ID,Event Version,Level,Channel,Task,Opcode,Keyword,Windows,Version,Edition,Date,Build,Event Message,Event Fields
2147490174,0,,,,,,Windows Server 2008R2,SP1,Standard,2011/02/09,7601,Zone {param1} version {param2} is newer than version {param3} on DNS server at {param4}.  The zone was not updated. DNS servers supplying zones for transfer must have the most recent version of the zone; based on the primary zone.  If zone on remote server {param4}; is in fact the most recent version of the zone; do the following at that server:  (1) stop the DNS server;  (2) delete the zone file (not the zone itself) and  (3) restart the DNS server The DNS server will transfer the new version and write its zone file. When deleting the zone file at server {param4}; locate the file named {param1}.dns in the %SystemRoot%\System32\Dns directory and delete it. An alternative solution is to delete and recreate the secondary zone at server {param4}.  This could be preferred if this server hosts large zones and restarting it at this time would be a consuming or costly operation.,{param1} | {param2} | {param3} | {param4} | {param4} | {param4} | {param1} | {param4}
2147490183,0,,,,,,Windows Server 2008R2,SP1,Standard,2011/02/09,7601,The master DNS server at {param2} responded to IXFR (Incremental Zone Transfer) request for zone {param1} with an invalid (FORMAT ERROR) response.  DNS server performance and network bandwidth will both be improved by upgrading the DNS server at {param2} to a run as either a Windows 2000 or later Microsoft DNS server or another IXFR-compatible DNS server implementation.,{param2} | {param1} | {param2}
2147490708,0,,,,,,Windows Server 2008R2,SP1,Standard,2011/02/09,7601,The DNS server could not connect to DNS server at {param1}. The event data contains the error.,{param1}
2147490710,0,,,,,,Windows Server 2008R2,SP1,Standard,2011/02/09,7601,The DNS server encountered a packet addressed to itself on IP address {param1}. The packet is for the DNS name '{param2}'. The packet will be discarded. This condition usually indicates a configuration error.  Check the following areas for possible self-send configuration errors:   1) Forwarders list. (DNS servers should not forward to themselves).   2) Master lists of secondary zones.   3) Notify lists of primary zones.   4) Delegations of subzones.  Must not contain NS record for this DNS server unless subzone is also on this server.   5) Root hints.  Example of self-delegation:   -> This DNS server dns1.example.microsoft.com is the primary for the zone example.microsoft.com.   -> The example.microsoft.com zone contains a delegation of bar.example.microsoft.com to dns1.example.microsoft.com;   (bar.example.microsoft.com NS dns1.example.microsoft.com)   -> BUT the bar.example.microsoft.com zone is NOT on this server.  Note; you should make this delegation check (with nslookup or DNS manager) both on this DNS server and on the server(s) you delegated the subzone to. It is possible that the delegation was done correctly; but that the primary DNS for the subzone; has any incorrect NS record pointing back at this server. If this incorrect NS record is cached at this server; then the self-send could result.  If found; the subzone DNS server admin should remove the offending NS record.  You can use the DNS server debug logging facility to track down the cause of this problem.,{param1} | {param2}
2147491148,0,,,,,,Windows Server 2008R2,SP1,Standard,2011/02/09,7601,The DNS server failed to process a packet from {param1}.  The packet was discarded.,{param1}
2147491248,0,,,,,,Windows Server 2008R2,SP1,Standard,2011/02/09,7601,The global query block list is a feature that prevents attacks on your network by blocking DNS queries for specific host names. This feature has caused the DNS server to fail a query with error code NAME ERROR for {param1} even though data for this DNS name exists in the DNS database. Other queries in all locally authoritative zones for other names that begin with labels in the block list will also fail; but no event will be logged when further queries are blocked until the DNS server service on this computer is restarted. See product documentation for information about this feature and instructions on how to configure it. Below is the current global query block list (this list may be truncated in this event if it is too long):{param2},{param1} | {param2}
2147491264,0,,,,,,Windows Server 2008R2,SP1,Standard,2011/02/09,7601,The TrustAnchors zone could not be loaded:{param1},{param1}
3221225482,0,,,,,,Windows Server 2008R2,SP1,Standard,2011/02/09,7601,The DNS server could not start because it is dependent on the NTDS service which is not started.,
3221225583,0,,,,,,Windows Server 2008R2,SP1,Standard,2011/02/09,7601,The DNS server could not create a thread.  System may be out of resources. You might close applications not in use; restart the DNS server or reboot your computer.  The event data is the error code.,
3221225603,0,,,,,,Windows Server 2008R2,SP1,Standard,2011/02/09,7601,The DNS server failed to initialize NetBIOS lookups to support WINSR for reverse lookup zones.  The server will continue to run but will not attempt to perform WINS reverse lookups.  This may be due to an incorrect configuration.  If WINSR lookups are not required; remove WINSR records from zone data files and reload modified zones or restart the DNS server.  If the DNS server should support WINSR reverse lookup; restart the server computer and verify that the WINS/NetBT configuration for TCP/IP client properties on the computer are correctly set.,
3221225612,0,,,,,,Windows Server 2008R2,SP1,Standard,2011/02/09,7601,The DNS server could not initialize the remote procedure call (RPC) service. If it is not running; start the RPC service or reboot the computer. The event data is the error code.,
3221225622,0,,,,,,Windows Server 2008R2,SP1,Standard,2011/02/09,7601,The DNS server could not load or initialize the plug-in DLL {param1}. The event data is the error code returned by the plug-in DLL load or initialization attempt. Please correct the plug-in error that is causing this condition or remove the plug-in from the DNS server configuration.,{param1}
3221225875,0,,,,,,Windows Server 2008R2,SP1,Standard,2011/02/09,7601,The DNS server could not create a Transmission Control Protocol (TCP) socket. Restart the DNS server or reboot the computer. The event data is the error code.,
3221225876,0,,,,,,Windows Server 2008R2,SP1,Standard,2011/02/09,7601,The DNS server could not bind a Transmission Control Protocol (TCP) socket to address {param1}.  The event data is the error code.  An IP address of 0.0.0.0 can indicate a valid 'any address' configuration in which all configured IP addresses on the computer are available for use. Restart the DNS server or reboot the computer.,{param1}
3221225877,0,,,,,,Windows Server 2008R2,SP1,Standard,2011/02/09,7601,The DNS server could not listen on Transmission Control Protocol (TCP) socket for address {param1}. The event data is the error code.  An IP address of 0.0.0.0 can indicate a valid 'any address' configuration in which all configured IP addresses on the computer are available for use. Restart the DNS server or reboot the computer.,{param1}
3221225878,0,,,,,,Windows Server 2008R2,SP1,Standard,2011/02/09,7601,The DNS server could not create a User Datagram Protocol (UDP) socket. The event data is the error code. Restart the DNS server or reboot your computer.,
3221225879,0,,,,,,Windows Server 2008R2,SP1,Standard,2011/02/09,7601,The DNS server could not bind a User Datagram Protocol (UDP) socket to {param1}. The event data is the error code. Restart the DNS server or reboot your computer.,{param1}
3221225880,0,,,,,,Windows Server 2008R2,SP1,Standard,2011/02/09,7601,The DNS server could not open socket for address {param1}. Verify that this is a valid IP address for the server computer.  If it is NOT valid use the Interfaces dialog under Server Properties in the DNS Manager to remove it from the list of IP interfaces.  Then stop and restart the DNS server. (If this was the only IP interface on this machine and the DNS server may not have started as a result of this error.  In that case remove the DNS\Parameters\ ListenAddress value in the services section of the registry and restart.)  If this is a valid IP address for this machine; make sure that no other application (e.g. another DNS server) is running that would attempt to use the DNS port.  For more information; see 'DNS server log reference' in the online Help.,{param1}
3221225882,0,,,,,,Windows Server 2008R2,SP1,Standard,2011/02/09,7601,The DNS server list of restricted interfaces does not contain a valid IP address for the server computer. The DNS server will use all IP interfaces on the machine.  Use the DNS manager server properties; interfaces dialog; to verify and reset the IP addresses the DNS server should listen on.  For more information; see 'To restrict a DNS server to listen only on selected addresses' in the online Help.,
3221225972,0,,,,,,Windows Server 2008R2,SP1,Standard,2011/02/09,7601,The DNS server has detected that the zone {param1} has invalid or corrupted registry data.  To correct the problem; you can delete the applicable zone subkey; located under DNS server parameters in the registry. You can then recreate the zone using the DNS console.  For more information; see 'Tuning advanced server parameters' and 'Add and Remove Zones' in the online Help.,{param1}
3221225973,0,,,,,,Windows Server 2008R2,SP1,Standard,2011/02/09,7601,The DNS server has detected that the zone {param1} has a missing or corrupted zone type in registry data.  To correct the problem; you can delete the applicable zone subkey; located under DNS server parameters in the registry.   You can then recreate the zone using the DNS console.  For more information; see 'Tuning advanced server parameters' and 'Add and Remove Zones' in the online Help.,{param1}
3221225974,0,,,,,,Windows Server 2008R2,SP1,Standard,2011/02/09,7601,The DNS server has detected that for the primary zone {param1} its has no zone file name stored in registry data.  You can either update the zone file name or delete the zone and recreate it using the DNS console.  To delete the applicable zone from the registry; locate its subkey under DNS server parameters in the registry.  You can then recreate the zone using the DNS console.  For more information; see 'To change a zone file name'; 'Tuning advanced server parameters' and 'Add and Remove Zones' in the online Help.,{param1}
3221225975,0,,,,,,Windows Server 2008R2,SP1,Standard,2011/02/09,7601,The DNS server has detected that the secondary zone {param1} has no master IP addresses in registry data.  Secondary zones require at least one master server to act as a source.  You can add or update the IP address for the master server for this zone using the DNS console.  For more information; see 'To update the master server for a secondary zone' in the online Help.,{param1}
3221225976,0,,,,,,Windows Server 2008R2,SP1,Standard,2011/02/09,7601,The DNS server could not create zone {param1} from registry data.  One or more of the zone registry key values could be corrupted or the zone file is missing. Use the DNS console to replace or repair any corrupted registry key values or confirm that the zone database is available.  For more information; see 'Configure zone properties' in the online Help.,{param1}
3221225977,0,,,,,,Windows Server 2008R2,SP1,Standard,2011/02/09,7601,The DNS server zone {param1} has invalid or corrupted registry data for {param2}. Use the DNS console to replace or repair any corrupted registry key values or confirm that the zone database is available.  For more information; see the online Help.,{param1} | {param2}
3221225978,0,,,,,,Windows Server 2008R2,SP1,Standard,2011/02/09,7601,The DNS server has invalid or corrupted registry parameter {param1}.  To correct the problem; you can delete the applicable registry value; located under DNS server parameters in the registry.  You can then recreate it using the DNS console.  For more information; see the online Help.,{param1}
3221225979,0,,,,,,Windows Server 2008R2,SP1,Standard,2011/02/09,7601,The DNS server encountered invalid or corrupted forwarder parameters in registry data.  To fix the forwarders: 	 - connect to or open this server in DNS Manager 	 - bring up server properties 	 - open 'Forwarders' tab 	 - reset forwarders information to desired values 	 - click OK  For more information; see the online Help.,
3221226179,0,,,,,,Windows Server 2008R2,SP1,Standard,2011/02/09,7601,The DNS server is not root authoritative and no root hints were specified in the cache.dns file. Where the server is not a root server; this file must specify root hints in the form of at least one name server (NS) resource record; indicating a root DNS server and a corresponding host (A) resource record for that root DNS server.  Otherwise; the DNS server will be unable to contact the root DNS server on startup and will be unable to answer queries for names outside of its own authoritative zones.  To correct this problem; use the DNS console to update the server root hints.  For more information; see the online Help.,
3221226472,0,,,,,,Windows Server 2008R2,SP1,Standard,2011/02/09,7601,The DNS server could not open the file {param1}.  Check that the file exists in the %SystemRoot%\System32\Dns directory and that it contains valid data. The event data is the error code.,{param1}
3221226473,0,,,,,,Windows Server 2008R2,SP1,Standard,2011/02/09,7601,The DNS server could not map file {param1} to memory.  Either close other applications that are not in use or reboot the computer to reclaim additional memory for the server to use.,{param1}
3221226475,0,,,,,,Windows Server 2008R2,SP1,Standard,2011/02/09,7601,The DNS server could not find or open the root hints file; Cache.dns; in the %SystemRoot%\System32\Dns directory.  Verify that this file is located in this directory and that it contains at least one name server (NS) resource record; indicating a root DNS server and a corresponding host (A) resource record for that server.  For more information; see the online Help.,
3221226476,0,,,,,,Windows Server 2008R2,SP1,Standard,2011/02/09,7601,The DNS server could not find or open zone file {param1}.  in the %SystemRoot%\System32\Dns directory.  Verify that the zone file is located in this directory and that it contains valid data.,{param1}
3221226480,0,,,,,,Windows Server 2008R2,SP1,Standard,2011/02/09,7601,The DNS server was unable to create the path for file {param1} in directory {param2}. The specified path is too long.  Choose a different path.,{param1} | {param2}
3221226672,0,,,,,,Windows Server 2008R2,SP1,Standard,2011/02/09,7601,The DNS server could not find or open boot file {param1}.  This file should be called 'Boot' and be located in the %SystemRoot%\System32\Dns directory.,{param1}
3221226673,0,,,,,,Windows Server 2008R2,SP1,Standard,2011/02/09,7601,The DNS server could not create zone {param1} specified in file {param2} at line {param3}.  Check that the zone file is located in the %SystemRoot%\System32\Dns directory and that it contains valid data.,{param1} | {param2} | {param3}
3221226675,0,,,,,,Windows Server 2008R2,SP1,Standard,2011/02/09,7601,The DNS server encountered a 'forwarders' directive in with no forwarding addresses in file {param1} at line {param2}.  Although the DNS server will continue running it will not be able to forward unresolved queries to the forwarders.  To correct the problem; in the DNS console select the server in the console tree; then from the Action menu; click Properties and click the Forwarders tab.  Add IP addresses for forwarders.  For more information; see 'Using forwarders' in the online Help.,{param1} | {param2}
3221226677,0,,,,,,Windows Server 2008R2,SP1,Standard,2011/02/09,7601,The DNS server encountered an unknown boot option {param1} in file {param2} at line {param3}. The option is ignored.  You may want to remove it the option from the boot file which is located in the %SystemRoot%\System32\Dns directory.,{param1} | {param2} | {param3}
3221226678,0,,,,,,Windows Server 2008R2,SP1,Standard,2011/02/09,7601,DNS server encountered missing database directory name; in file {param1}; line {param2}.,{param1} | {param2}
3221226973,0,,,,,,Windows Server 2008R2,SP1,Standard,2011/02/09,7601,The DNS server could not parse zone file {param1} for zone {param2}.  Check that the zone file is located in the %SystemRoot%\System32\Dns directory and that it contains valid data.,{param1} | {param2}
3221226974,0,,,,,,Windows Server 2008R2,SP1,Standard,2011/02/09,7601,The DNS server could not parse the token '{param1}' in zone file {param2} at line {param3}. Although the DNS server will continue to load; ignoring this token; it is recommended that you either correct the token or remove this resource record from the zone file.  The zone file is located in the %SystemRoot%\System32\Dns directory.,{param1} | {param2} | {param3}
3221226975,0,,,,,,Windows Server 2008R2,SP1,Standard,2011/02/09,7601,The DNS server could not parse the zone file {param1} at line {param2}.  Although the DNS server continues to load; ignoring this line; it is recommended that you either correct the line or remove it from the zone file.  The zone file is located in the %SystemRoot%\System32\Dns directory.,{param1} | {param2}
3221226976,0,,,,,,Windows Server 2008R2,SP1,Standard,2011/02/09,7601,The DNS server could not parse an unexpected token '{param1}' in zone file {param2} at line {param3}.  Although the DNS server continues to load; ignoring this token; it is recommended that you either correct the token or remove the resource record from the zone file; which is located in the %SystemRoot%\System32\Dns directory.,{param1} | {param2} | {param3}
3221226977,0,,,,,,Windows Server 2008R2,SP1,Standard,2011/02/09,7601,The DNS server unexpected end of line; in zone file {param1} at line {param2}.  To correct the problem; fix this line in the zone file; which is located in the %SystemRoot%\System32\Dns directory.,{param1} | {param2}
3221226978,0,,,,,,Windows Server 2008R2,SP1,Standard,2011/02/09,7601,The DNS server encountered invalid token '{param1}' in zone file {param2} at line {param3}. Although the DNS server continues to load; ignoring this token; it is recommended that you either correct the token or remove this resource record from the zone file.  The zone file is located in the %SystemRoot%\System32\Dns directory.,{param1} | {param2} | {param3}
3221226979,0,,,,,,Windows Server 2008R2,SP1,Standard,2011/02/09,7601,The DNS server encountered invalid class token '{param1}' in zone file {param2} at line {param3}.  Although the DNS server continues to load; ignoring this resource record (RR); it is recommended that you either correct the class of the RR to use the Internet (IN) class or remove the resource record from the zone file. The DNS server supports only the Internet (IN) class in RRs.,{param1} | {param2} | {param3}
3221226980,0,,,,,,Windows Server 2008R2,SP1,Standard,2011/02/09,7601,The DNS server is ignoring an invalid resource record in zone file {param1} at line {param2}. See the previously logged event for a description of the error. Although the DNS server continues to load; ignoring this RR; it is recommended that you investigate the error associated with this record and either correct it or remove it from the zone file.,{param1} | {param2}
3221226996,0,,,,,,Windows Server 2008R2,SP1,Standard,2011/02/09,7601,DNSSEC signatures with key tag {param1}; associated with records in  zone {param2}; have expired.  Name resolution will fail for resolvers that require validation until new signatures are created.  To create new signatures; re-sign the zone.,{param1} | {param2}
3221227012,0,,,,,,Windows Server 2008R2,SP1,Standard,2011/02/09,7601,The DNS server unable to create domain node.,
3221227013,0,,,,,,Windows Server 2008R2,SP1,Standard,2011/02/09,7601,The DNS server encountered invalid domain name '{param1}' in zone file {param2} at line {param3}. Although the DNS server continues to load; ignoring this name; it is strongly recommended that you either correct the name or remove the resource record from the zone file; which is located in the %SystemRoot%\System32\Dns directory.,{param1} | {param2} | {param3}
3221227014,0,,,,,,Windows Server 2008R2,SP1,Standard,2011/02/09,7601,The DNS server encountered invalid domain name '{param1}'.,{param1}
3221227015,0,,,,,,Windows Server 2008R2,SP1,Standard,2011/02/09,7601,The DNS server encountered domain name '{param1}' exceeding maximum length. Although the DNS server continues to load; ignoring this name; it is recommended that you either correct the name or remove the resource record from the zone file; which is located in the %SystemRoot%\System32\Dns directory.,{param1}
3221227016,0,,,,,,Windows Server 2008R2,SP1,Standard,2011/02/09,7601,The DNS server encountered an invalid '@' token '{param1}' in zone file {param2} at line {param3}.  Although the DNS server continues to load; ignoring this token; it is recommended that you either correct the token or remove the resource record from the zone file.  The zone file is located in the %SystemRoot%\System32\Dns directory.,{param1} | {param2} | {param3}
3221227017,0,,,,,,Windows Server 2008R2,SP1,Standard,2011/02/09,7601,The DNS server encountered a name outside of the specified zone in zone file {param1} at line {param2}.  Although the DNS server continues to load; ignoring this resource record (RR); it is recommended that you either correct the RR or remove it from the zone file; which is located in the %SystemRoot%\System32\Dns directory.,{param1} | {param2}
3221227018,0,,,,,,Windows Server 2008R2,SP1,Standard,2011/02/09,7601,The DNS server encountered an invalid name server (NS) resource record in zone file {param1} at line {param2}.  The use of NS resource records (RR) must be at either the zone root node or be placed at at the sub-zone context within the zone for a domain being delegated away from this zone. Although the DNS server continues to load; ignoring this RR; it is recommended that you either correct the RR or remove it from the zone file.  The zone file is located in the %SystemRoot%\System32\Dns directory.  For more information; see 'Delegating zones' in the online Help.,{param1} | {param2}
3221227019,0,,,,,,Windows Server 2008R2,SP1,Standard,2011/02/09,7601,The DNS server encountered an invalid host (A) resource record in zone file {param1} at line {param2}.  The use of A resource records (RRs) must be at a domain name within the zone; with the exception of glue A RRs which are used to resolve the host name specified in an NS RR also contained at the same domain node and used for a zone delegation.  Although the DNS server continues to load; ignoring this RR; it is strongly recommended that you either correct this RR or remove it from the zone file.  The zone file is located in the %SystemRoot%\System32\Dns directory.  For more information; see 'Delegating zones' in the online Help.,{param1} | {param2}
3221227072,0,,,,,,Windows Server 2008R2,SP1,Standard,2011/02/09,7601,The DNS server encountered an unknown or unsupported resource record (RR) type {param1} in zone file {param2} at line {param3}.  Although the DNS server continues to load; ignoring this RR; it is recommended that you either correct the record type or remove this RR from the zone file.  The zone file is located in the %SystemRoot%\System32\Dns directory.,{param1} | {param2} | {param3}
3221227074,0,,,,,,Windows Server 2008R2,SP1,Standard,2011/02/09,7601,The DNS server encountered an invalid SOA (Start Of Authority) resource record (RR) in file {param1} at line {param2}. An SOA record is required in every zone files and must satify the following conditions:  1)  The SOA record must be the first record in the zone file.  2)  The SOA record must belong to the root of the zone ('@' in zone file).  3)  Only one SOA is allowed in the zone.  4)  SOA records are NOT valid in root-hints (cache.dns) file.  To correct the problem modify or repair the SOA RR in zone file {param1}; which can be found in the %SystemRoot%\System32\Dns directory. For more information; see the 'Resource records reference' in the online Help.,{param1} | {param2} | {param1}
3221227082,0,,,,,,Windows Server 2008R2,SP1,Standard,2011/02/09,7601,The DNS server encountered a resource record (RR) in the zone file {param1} at line {param2} for a domain name with an existing CNAME (alias) RR.  Where used; CNAME RRs must be the only RR for the domain name they are used to provide an alias for.  Either this RR; or the CNAME RR it conflicts with; needs to be deleted from zone file {param1}; which can be found in the %SystemRoot%\System32\Dns directory.,{param1} | {param2} | {param1}
3221227083,0,,,,,,Windows Server 2008R2,SP1,Standard,2011/02/09,7601,The DNS server encountered a CNAME (alias) resource record (RR) in zone file {param1} at line {param2} for a domain name with existing RRs.  Where used; CNAME RRs must be the only RR for the domain name they are used to provide an alias for.  Either this CNAME RR; or the one it conflicts with; needs to be deleted from zone file {param1}; which can be found in the %SystemRoot%\System32\Dns directory.,{param1} | {param2} | {param1}
3221227084,0,,,,,,Windows Server 2008R2,SP1,Standard,2011/02/09,7601,The DNS server encountered an alias (CNAME or DNAME) resource record (RR) in zone file {param1} at line {param2} that forms an alias loop with another alias RR in the zone.  One of the alias RRs forming the loop must be removed from the zone file.  The zone file is located in the %SystemRoot%\System32\Dns directory.,{param1} | {param2}
