Provider,Level,Event ID,Version,Channel,Task,Opcode,Keyword,Message
Microsoft-Windows-CertificateServicesClient,win:Informational,1,0,Application,,,,
Microsoft-Windows-CertificateServicesClient,win:Informational,2,0,Application,,,,
Microsoft-Windows-CertificateServicesClient,win:Warning,501,0,Application,,,,Certificate Services Client is triggered with bad parameters: {Parameter}.
Microsoft-Windows-CertificateServicesClient,win:Warning,502,0,Application,,,,Certificate Services Client failed to register Group Policy notifications. Error code: {ErrorCode}.
Microsoft-Windows-CertificateServicesClient,win:Error,1001,0,Application,,,,Certificate Services Client failed to load Provider {ProviderName}. Error code {ErrorCode}.
Microsoft-Windows-CertificateServicesClient,win:Error,1002,0,Application,,,,Certificate Services Client cannot find the required interface in Provider {ProviderName}. Error code {ErrorCode}.
Microsoft-Windows-CertificateServicesClient,win:Error,1003,0,Application,,,,Certificate Services Client  failed to invoke the Providers in response to event {Flags}. Error code {ErrorCode}.
Microsoft-Windows-CertificateServicesClient,win:Error,1004,0,Application,,,,Certificate Services Client Provider {ProviderName} raised an exception. Exception code {ErrorCode}.
