Provider,Level,Event ID,Version,Channel,Task,Opcode,Keyword,Message
Microsoft-Windows-AssignedAccess,Error,10001,0,Microsoft-Windows-AssignedAccess/Admin,Configuring Assigned Access,,,Could not configure user. The specified SID was not found on this system.
Microsoft-Windows-AssignedAccess,Error,10002,0,Microsoft-Windows-AssignedAccess/Admin,Configuring Assigned Access,,,Could not configure user. The specified SID is an administrator on this system. Locking down administrator users could lead to unconfigurable devices.
Microsoft-Windows-AssignedAccess,Error,10003,0,Microsoft-Windows-AssignedAccess/Admin,Configuring Assigned Access,,,Could not configure user. The specified SID is a domain account.  Only local accounts can be used.
Microsoft-Windows-AssignedAccess,Error,10004,0,Microsoft-Windows-AssignedAccess/Admin,Configuring Assigned Access,,,Could not configure application. The specified AppID may be invalid; or is not installed on this system. The specified user may need to log in and download this application first.
Microsoft-Windows-AssignedAccess,Error,10010,0,Microsoft-Windows-AssignedAccess/Admin,Configuring Assigned Access,,,Could not configure application launching.
Microsoft-Windows-AssignedAccess,Error,10020,0,Microsoft-Windows-AssignedAccess/Admin,Configuring Assigned Access,,,Could not configure keyboard filtering.
Microsoft-Windows-AssignedAccess,Information,20000,0,Microsoft-Windows-AssignedAccess/Operational,Configuring Assigned Access,,,Assigned Access is enabled. For settings to take effect; log off and log back in as this user.
Microsoft-Windows-AssignedAccess,Information,20001,0,Microsoft-Windows-AssignedAccess/Operational,Configuring Assigned Access,,,Assigned Access is disabled.  System will return to original settings.
Microsoft-Windows-AssignedAccess,Information,30000,0,Microsoft-Windows-AssignedAccess/Admin,AssignedAccessCsp,,,{File}({LineNumber}); hr = {ErrorCode}
