Provider,Level,Event ID,Version,Channel,Task,Opcode,Keyword,Message
Microsoft-Windows-StorPort,Error,536,3,,Device failed and will be removed.,Device failed and will be removed.,PortNotification,Miniport notifies device(Port = {AdapterInterfaceType}; Path = {Bus}; Target = {Device}; Lun = {Function}) failed and should be removed.                    Storport has notified PnP manager to remove the failed device.                    Corresponding Class Disk Device Guid: {PortNumber}                    Adapter Guid: {PathID}                    Miniport driver name: {TargetID}                    VendorId: {LUN}                    ProductId: {ClassDeviceGuid}                    SerialNumber: {AdapterInterfaceType}0                    AdapterSerialNumber: {AdapterInterfaceType}1                    Fault Code: {AdapterInterfaceType}2                    Fault Description: {AdapterInterfaceType}3
Microsoft-Windows-StorPort,Error,537,3,,Port,,,The miniport logged a health event.
Microsoft-Windows-StorPort,Error,538,3,,Port,,,The miniport logged a health event.
Microsoft-Windows-StorPort,Error,539,3,,Port,,,The miniport logged a health event.
Microsoft-Windows-StorPort,Error,540,3,,Port,,,The miniport logged a health event.
Microsoft-Windows-StorPort,Error,541,3,,Port,,,The miniport logged a health event.
Microsoft-Windows-StorPort,Error,542,3,,Port,,,The miniport logged a health event.
Microsoft-Windows-StorPort,Warning,543,3,,Port,,,The miniport logged a health event.
Microsoft-Windows-StorPort,Warning,544,3,,Port,,,The miniport logged a health event.
Microsoft-Windows-StorPort,Warning,545,3,,Port,,,The miniport logged a health event.
Microsoft-Windows-StorPort,Warning,546,3,,Port,,,The miniport logged a health event.
Microsoft-Windows-StorPort,Warning,547,3,,Port,,,The miniport logged a health event.
Microsoft-Windows-StorPort,Warning,548,3,,Port,,,The miniport logged a health event.
Microsoft-Windows-StorPort,Error,549,2,,Port,,Read request Write request,This is the first instance of the error seen during this time period                     on Storport Device (Port = {PortNumber}; Path = {PathID}; Target = {TargetID}; Lun = {LUN}) whose Corresponding Class Disk Device Guid is {ClassDeviceGuid}:                     The request opcode was {PortNumber}7 and completed with SrbStatus {PortNumber}8 and ScsiStatus {PortNumber}9.                     The sense code was ({PathID}0;{PathID}1;{PathID}2).                     The io latency was {PortNumber}5 ms.
Microsoft-Windows-StorPort,Warning,550,1,,Port,,Reset,A hierarchical reset was performed for Storport Device (Port = {PortNumber}; Path = {PathID}; Target = {TargetID}; Lun = {LUN}).                    Corresponding Class Disk Device Guid is {ClassDeviceGuid}.
Microsoft-Windows-StorPort,Error,551,1,,Port,,PortNotification,Storport Device (Port = {PortNumber}; Path = {PathID}; Target = {TargetID}; Lun = {LUN}) was surprise removed.                    Corresponding Class Disk Device Guid is {ClassDeviceGuid}.
Microsoft-Windows-StorPort,Information,552,1,,Port,,PortNotification,Storport Device (Port = {PortNumber}; Path = {PathID}; Target = {TargetID}; Lun = {LUN}) has arrived.
Microsoft-Windows-StorPort,Information,553,1,,Port,,PortNotification,Storport Device {AdapterGuid} (Port = {PortNumber}) was rescanned and changes were detected.
Microsoft-Windows-StorPort,Warning,554,2,,Port,,PortNotification,Queued IO exceeded threshold for Storport Device (Port = {PortNumber}; Path = {PathID}; Target = {TargetID}; Lun = {LUN}).                    Corresponding Class Disk Device Guid is {ClassDeviceGuid}.
Microsoft-Windows-StorPort,Information,555,1,,Port,Start,,Host-initiated unit(Port = {PortNumber}; Path = {Bus}; Target = {Target}; Lun = {LUN}) maintenance time has started.                 Corresponding Class Disk Device Guid is {ClassDeviceGuid}.                 Adapter Guid: {AdapterGuid}                 Miniport driver name: {MiniportName}                 VendorId: {VendorId}                 ProductId: {ProductId}                 SerialNumber: {MiniportName}0
Microsoft-Windows-StorPort,Information,556,1,,Port,Stop,,Host-initiated unit(Port = {PortNumber}; Path = {Bus}; Target = {Target}; Lun = {LUN}) maintenance time has ended.                 Corresponding Class Disk Device Guid is {ClassDeviceGuid}.                 Adapter Guid: {AdapterGuid}                 Miniport driver name: {MiniportName}                 VendorId: {VendorId}                 ProductId: {ProductId}                 SerialNumber: {MiniportName}0                 Success: {MiniportName}1                 ActiveRefsDuringMaintenanceTime: {MiniportName}2
Microsoft-Windows-StorPort,Warning,557,2,,Port,,PortNotification,An IO took more than {MiniportName}2 ms to complete for Storport Device (Port = {PortNumber}; Path = {PathID}; Target = {TargetID}; Lun = {LUN}).                    Corresponding Class Disk Device Guid is {ClassDeviceGuid}.
Microsoft-Windows-StorPort,Error,558,3,,Mark device failed.,Device failed.,PortNotification,Miniport notifies device(Port = {AdapterInterfaceType}; Path = {Bus}; Target = {Device}; Lun = {Function}) failed.                    Corresponding Class Disk Device Guid: {PortNumber}                    Adapter Guid: {PathID}                    Miniport driver name: {TargetID}                    VendorId: {LUN}                    ProductId: {ClassDeviceGuid}                    SerialNumber: {AdapterInterfaceType}0                    AdapterSerialNumber: {AdapterInterfaceType}1                    Fault Code: {AdapterInterfaceType}2                    Fault Description: {AdapterInterfaceType}3
Microsoft-Windows-StorPort,Error,559,2,,,,Device state,SMR device is not supported on driver {MiniportName} (Port = {PortNumber}; Path = {PathID}; Target = {TargetID}; Lun = {LUN}).                    Adapter Guid: {AdapterGuid}                    VendorId: {VendorId}                    ProductId: {ProductId}                    SerialNumber: {SerialNumber}                    FirmWareRevision: {MiniportName}0                    Adapter Concurrent Channel Count: {MiniportName}1
Microsoft-Windows-StorPort,Warning,560,1,,Live Dump,,Device state,Miniport request to capture a live dump for device(Port = {PortNumber}; Path = {PathID}; Target = {TargetID}; Lun = {LUN}).                    Corresponding Class Disk Device Guid: {ClassDeviceGuid}                    Adapter Guid: {AdapterGuid}                    Miniport driver name: {MiniportName}                    Unit VendorId: {VendorId}                    Unit ProductId: {ProductId}                    Unit SerialNumber: {PortNumber}0                    Adapter SerialNumber: {PortNumber}1                    Adapter Vendor ID: {PortNumber}2                    Issue Type: {PortNumber}3                    NT Status: {PortNumber}4
Microsoft-Windows-StorPort,Warning,561,1,,,,Device state,Miniport requests to reset device.                    Adapter port number: {PortNumber}                    Adapter Guid: {AdapterGuid}                    Miniport driver name: {MiniportName}                    AdapterSerialNumber: {AdapterSerialNumber}                    Boot adapter: {BootAdapter}                    Reset type: {DeviceResetType}                    NtStatus: {NtStatus}                    PciDeviceType: {PciDeviceType}
Microsoft-Windows-StorPort,Warning,562,1,,Port,,PortNotification,Warning on Storport Device (Port = {PortNumber}; Path = {PathID}; Target = {TargetID}; Lun = {LUN}) whose Corresponding Class Disk Device Guid is {ClassDeviceGuid}:                    12.
Microsoft-Windows-StorPort,Information,563,1,,Port,,Read request Write request,IO size distribution summary for Storport Device (Port = {PortNumber}; Path = {PathID}; Target = {TargetID}; Lun = {LUN}) whose Corresponding Class Disk Device Guid is {ClassDeviceGuid}:                 Total Success IO:{PortNumber}8                 IO Size buckets:{PortNumber}6                 IO Latency buckets:{PortNumber}7                 Read IO Success counts for IO Size bucket 1 are {PortNumber}9.                 Read IO Success counts for IO Size bucket 2 are {PathID}1.                 Read IO Success counts for IO Size bucket 3 are {PathID}3.                 Read IO Success counts for IO Size bucket 4 are {PathID}5.                 Read IO Success counts for IO Size bucket 5 are {PathID}7.                 Read IO Success counts for IO Size bucket 6 are {PathID}9.                 Read IO Success counts for IO Size bucket 7 are {TargetID}1.                 Read IO Success counts for IO Size bucket 8 are {TargetID}3.                 Read IO Success counts for IO Size bucket 9 are {TargetID}5.                 Write IO Success counts for IO Size bucket 1 are {TargetID}7.                 Write IO Success counts for IO Size bucket 2 are {TargetID}9.                 Write IO Success counts for IO Size bucket 3 are {LUN}1.                 Write IO Success counts for IO Size bucket 4 are {LUN}3.                 Write IO Success counts for IO Size bucket 5 are {LUN}5.                 Write IO Success counts for IO Size bucket 6 are {LUN}7.                 Write IO Success counts for IO Size bucket 7 are {LUN}9.                 Write IO Success counts for IO Size bucket 8 are {ClassDeviceGuid}1.                 Write IO Success counts for IO Size bucket 9 are {ClassDeviceGuid}3.
Microsoft-Windows-StorPort,Information,564,1,,Port,,Device state,Log page data for Storport Device (Port = {PortNumber}; Path = {PathID}; Target = {TargetID}; Lun = {LUN}).                    Corresponding Class Disk Device Guid: {ClassDeviceGuid}.                    Adapter Guid: {AdapterGuid}                    Miniport driver name: {MiniportName}                    VendorId: {VendorId}                    ProductId: {ProductId}                    SerialNumber: {PortNumber}0                    AdapterSerialNumber: {PortNumber}1                    Log Page Code: {PortNumber}4                    Log Page Length: {PortNumber}5
Microsoft-Windows-StorPort,Information,565,1,,Port,,Device state,SCSI Diagnostic Logs for Storport Device (Port = {PortNumber}; Path = {PathID}; Target = {TargetID}; Lun = {LUN}).                    Corresponding Class Disk Device Guid is {ClassDeviceGuid}.
Microsoft-Windows-StorPort,Information,566,1,,Port,,,The miniport logged an event.
Microsoft-Windows-StorPort,Information,567,1,,Port,,,The miniport logged an event.
Microsoft-Windows-StorPort,Warning,568,1,,Port,,,The miniport logged an event.
Microsoft-Windows-StorPort,Information,569,1,,Port,,,The miniport logged an event.
Microsoft-Windows-StorPort,Warning,570,1,,Port,,,The miniport logged an event.
Microsoft-Windows-StorPort,Error,571,1,,Port,,,The miniport logged an event.
Microsoft-Windows-StorPort,Error,572,1,,,,Device state,SMR device reports invalid zone size on driver {MiniportName} (Port = {PortNumber}; Path = {PathID}; Target = {TargetID}; Lun = {LUN}).                    Adapter Guid: {AdapterGuid}                    VendorId: {VendorId}                    ProductId: {ProductId}                    SerialNumber: {SerialNumber}                    FirmWareRevision: {MiniportName}0                    Unit Zone Size: {MiniportName}1
Microsoft-Windows-StorPort,Information,573,1,,Port,,Config,Insufficient resources to allocate all requested gateways.                    Adapter port number: {PortNumber}                    Adapter hardware id: {AdapterHardwareId}                    Miniport driver name: {MiniportName}                    Performance optimization flags: {PerformanceOptimizationFlags}                    Max processor count: {MaximumProcessorCount}                    Active processor count: {ActiveProcessorCount}                    Processor count per gateway: {ProcessorCountPerGateway}                    Allocated gateway count: {AllocatedGatewayCount}                    Active gateway count required: {ActiveGatewayCountRequired}                    Gateways successfully initialized: {PortNumber}0                    NtStatus: {PortNumber}1
Microsoft-Windows-StorPort,Information,574,1,,Port,,Config,Required active gateways are more than total allocated gateways.                    Adapter port number: {PortNumber}                    Adapter hardware id: {AdapterHardwareId}                    Miniport driver name: {MiniportName}                    Performance optimization flags: {PerformanceOptimizationFlags}                    Max processor count: {MaximumProcessorCount}                    Active processor count: {ActiveProcessorCount}                    Processor count per gateway: {ProcessorCountPerGateway}                    Allocated gateway count: {AllocatedGatewayCount}                    Active gateway count required: {ActiveGatewayCountRequired}
Microsoft-Windows-StorPort,Warning,575,1,,Port,,,Retrying power up request on device(Port = {PortNumber}).                    Miniport driver name: {MiniportName}                    Adapter Guid: {AdapterGuid}
Microsoft-Windows-StorPort,Information,576,1,,,Storport initializes storage D3.,,Storport storage D3 setting.                    Adapter Guid: {AdapterGuid}                    Adapter port number: {PortNumber}                    Adapter hardware id: {AdapterHardwareId}                    Miniport driver name: {MiniportName}                    Adapter interface type: {AdapterInterfaceType}                    Flags: {Flags}                    Storage D3 allowed: {AllowStorageD3}                    ACPI DSD property: {AcpiDsdProperty}                    D3 registry key state: {StorageD3RegistryState}                    Storage D3 enable: {AdapterGuid}0                    DirectFx enable: {AdapterGuid}1
Microsoft-Windows-StorPort,Error,577,1,,,Miniport does not terminate system threads it created.,,Miniport does not terminate system threads it created when adapter is removed.                    Adapter port number: {PortNumber}                    Adapter Guid: {AdapterGuid}                    Miniport driver name: {MiniportName}                    Adapter SerialNumber: {AdapterSerialNumber}                    Maximum miniport system threads allowed: {SystemThreadMaximumCount}                    Current miniport system threads: {SystemThreadCurrentCount}
Microsoft-Windows-StorPort,Warning,578,1,,,,Config,Creation of the Storport control object failed.                    Status: {NtStatus}
Microsoft-Windows-StorPort,Information,579,1,,,,Config,Storport extension driver load was attempted.                    Status: {NtStatus}
Microsoft-Windows-StorPort,Information,580,1,,,,Config,Storport extension driver unload was attempted.                    Status: {NtStatus}
Microsoft-Windows-StorPort,Information,800,1,,,Register MFND interface.,Multiple Physical Function NVMe Device,Storport register MFND interface.                    Adapter port number: {PortNumber}                    Adapter Guid: {AdapterGuid}                    Miniport driver name: {MiniportName}                    Adapter SerialNumber: {AdapterSerialNumber}                    MFND interface name: {MFNDInterfaceName}                    NtStatus: {NtStatus}
Microsoft-Windows-StorPort,Information,801,1,,,Reconfigure MFND.,Multiple Physical Function NVMe Device,Reconfigure MFND.                    Adapter port number: {PortNumber}                    Adapter Guid: {AdapterGuid}                    Miniport driver name: {MiniportName}                    Adapter SerialNumber: {AdapterSerialNumber}                    MFND interface name: {MFNDInterfaceName}                    MFND operation mode: {OperationMode}                    MFND operation privilege: {OperationPrivilege}                    MFND reconfigure type: {ReconfigureType}                    Child physical function to create: {ChildPFCountToCreate}                    Maximum physical function count: {PortNumber}0                    Command status code (SC): {PortNumber}1                    Command status code type (SCT): {PortNumber}2                    NtStatus: {PortNumber}3
Microsoft-Windows-StorPort,Information,802,1,,,MFND child physical function control.,Multiple Physical Function NVMe Device,MFND child physical function control.                    Adapter port number: {PortNumber}                    Adapter Guid: {AdapterGuid}                    Miniport driver name: {MiniportName}                    Adapter SerialNumber: {AdapterSerialNumber}                    MFND interface name: {MFNDInterfaceName}                    MFND operation mode: {OperationMode}                    MFND operation privilege: {OperationPrivilege}                    Child controller ID: {ChildControllerID}                    Flags: {Flags}                    Control action: {PortNumber}0                    Command status code (SC): {PortNumber}1                    Command status code type (SCT): {PortNumber}2                    NtStatus: {PortNumber}3
Microsoft-Windows-StorPort,Information,803,1,,,Set MFND operation information.,Multiple Physical Function NVMe Device,Set MFND operation information.                    Adapter port number: {PortNumber}                    Adapter Guid: {AdapterGuid}                    Miniport driver name: {MiniportName}                    Adapter SerialNumber: {AdapterSerialNumber}                    MFND interface name: {MFNDInterfaceName}                    Child physical function count: {ChildPFCount}                    Enable: {Enable}                    MFND set operation select: {OperationSelect}                    Command status code (SC): {SC}                    Command status code type (SCT): {PortNumber}0                    NtStatus: {PortNumber}1
Microsoft-Windows-StorPort,Information,804,1,,,Set MFND child physical function property.,Multiple Physical Function NVMe Device,Set MFND child physical function property.                    Adapter port number: {PortNumber}                    Adapter Guid: {AdapterGuid}                    Miniport driver name: {MiniportName}                    Adapter SerialNumber: {AdapterSerialNumber}                    MFND interface name: {MFNDInterfaceName}                    Flags: {Flags}                    Namespace metadata size: {NamespaceMetadataSize}                    Namespace LBA data size: {NamespaceLBADataSize}                    Namespace data protection type: {NamespaceDPS}                    Namespace MPIO and Namespace Sharing Capabilities: {PortNumber}0                    Command status code (SC): {PortNumber}1                    Command status code type (SCT): {PortNumber}2                    NtStatus: {PortNumber}3
Microsoft-Windows-StorPort,Information,805,1,,,Set MFND child physical function settings.,Multiple Physical Function NVMe Device,Set MFND child physical function settings.                    Adapter port number: {PortNumber}                    Adapter Guid: {AdapterGuid}                    Miniport driver name: {MiniportName}                    Adapter SerialNumber: {AdapterSerialNumber}                    MFND interface name: {MFNDInterfaceName}                    Child controller ID: {ChildControllerID}                    Flags: {Flags}                    IO queue pair count: {IoQueuePairCount}                    Interrupt count: {InterruptCount}                    Namespace count: {PortNumber}0                    Storage provision count: {PortNumber}1                    QoS policy: {PortNumber}2                    Reserve read bandwidth in MBps: {PortNumber}3                    Reserve write bandwidth in MBps: {PortNumber}4                    Limit bandwidth in MBps: {PortNumber}5                    Limit write bandwidth in MBps: {PortNumber}6                    Reserve read IOPS: {PortNumber}7                    Reserve write IOPS: {PortNumber}8                    Limit IOPS: {PortNumber}9                    Limit write IOPS: {AdapterGuid}0                    Command status code (SC): {AdapterGuid}1                    Command status code type (SCT): {AdapterGuid}2                    NtStatus: {AdapterGuid}3
Microsoft-Windows-StorPort,Information,806,1,,,Set MFND child physical function QoS.,Multiple Physical Function NVMe Device,Set MFND child physical function QoS.                    Adapter port number: {PortNumber}                    Adapter Guid: {AdapterGuid}                    Miniport driver name: {MiniportName}                    Adapter SerialNumber: {AdapterSerialNumber}                    MFND interface name: {MFNDInterfaceName}                    Child controller ID: {ChildControllerID}                    QoS policy: {QoSPolicy}                    Reserve read bandwidth in MBps: {ReserveReadBandwidthInMBps}                    Reserve write bandwidth in MBps: {ReserveWriteBandwidthInMBps}                    Limit bandwidth in MBps: {PortNumber}0                    Limit write bandwidth in MBps: {PortNumber}1                    Reserve read IOPS: {PortNumber}2                    Reserve write IOPS: {PortNumber}3                    Limit IOPS: {PortNumber}4                    Limit write IOPS: {PortNumber}5                    Command status code (SC): {PortNumber}6                    Command status code type (SCT): {PortNumber}7                    NtStatus: {PortNumber}8
Microsoft-Windows-StorPort,Information,807,1,,,Set MFND child physical function admin commands permission.,Multiple Physical Function NVMe Device,Set MFND child physical function admin commands permission.                    Adapter port number: {PortNumber}                    Adapter Guid: {AdapterGuid}                    Miniport driver name: {MiniportName}                    Adapter SerialNumber: {AdapterSerialNumber}                    MFND interface name: {MFNDInterfaceName}                    Command count: {CommandCount}                    Command status code (SC): {SC}                    Command status code type (SCT): {PortNumber}0                    NtStatus: {PortNumber}1
