Provider,Level,Event ID,Version,Channel,Task,Opcode,Keyword,Message
Microsoft-Windows-StorPort,Error,1,1,,Logical Unit reset,OpCodeLUReset,Reset,Logical Unit reset
Microsoft-Windows-StorPort,Error,2,1,,Target reset,OpCodeTargetReset,Reset,Target reset
Microsoft-Windows-StorPort,Information,4,1,,Reset detected notification,OpCodeResetDetected,PortNotification,Reset detected notification
Microsoft-Windows-StorPort,Information,5,1,,Link down notification,OpCodeLinkDown,PortNotification,Link down notification
Microsoft-Windows-StorPort,Information,6,1,,Link Up notification,OpCodeLinkUp,PortNotification,Link Up notification
Microsoft-Windows-StorPort,Information,7,1,,Request Timer notification,OpCodeRequestTimerCall,PortNotification,Request Timer notification
Microsoft-Windows-StorPort,Information,8,1,,Port pause,OpCodePortPause,PauseResume,Port pause
Microsoft-Windows-StorPort,Information,9,1,,Port resume,OpCodePortResume,PauseResume,Port resume
Microsoft-Windows-StorPort,Information,10,1,,Port pause device,OpCodePortPauseDevice,PauseResume,Port pause device
Microsoft-Windows-StorPort,Information,11,1,,Port resume device,OpCodePortResumeDevice,PauseResume,Port resume device
Microsoft-Windows-StorPort,Information,12,1,,Bus change detect notification,OpCodeBusChangeDetected,PortNotification,Bus change detect notification
Microsoft-Windows-StorPort,Information,13,1,,Miniport IO Request Service Time,OpCodeMiniportIORequestServiceTime,IO Performance Notification from Miniport,Miniport IO Request Service Time
Microsoft-Windows-StorPort,Information,14,1,,,,Config,Port configuration setting changed
Microsoft-Windows-StorPort,Information,15,1,,,,Config,Set LUN queue depth
Microsoft-Windows-StorPort,Information,16,1,,,,Config,Set adapter resource list
Microsoft-Windows-StorPort,Information,17,1,,,,Config,Increase adapter resource list
Microsoft-Windows-StorPort,Warning,18,1,,,,Config,Adapter resource list failure
Microsoft-Windows-StorPort,Information,19,1,,,,Config,Initial perf configuration data
Microsoft-Windows-StorPort,Information,20,1,,,,Config,Final perf configuration data
Microsoft-Windows-StorPort,Information,21,1,,,,Config,HW_INITIALIZATION_DATA data
Microsoft-Windows-StorPort,Information,22,1,,,,Config,Initial PORT_CONFIGURATION_INFORMATION data
Microsoft-Windows-StorPort,Information,23,1,,,,Config,Final PORT_CONFIGURATION_INFORMATION data
Microsoft-Windows-StorPort,Information,24,1,,,,Perf,Operation duration
Microsoft-Windows-StorPort,Information,25,1,,State change detect notification,OpCodeStateChangeDetected,PortNotification,State change detect notification
Microsoft-Windows-StorPort,Information,26,1,,Targeted reenumeration,OpCodeTargetedReenumeration,,Targeted reenumeration
Microsoft-Windows-StorPort,Information,200,2,,Port,,IO Performance measurement,Request servicing time taken by target device.
Microsoft-Windows-StorPort,Information,201,2,,Port,,IO Performance measurement,Request servicing time taken by lower driver stack(s).
Microsoft-Windows-StorPort,Information,202,2,,Port,Dispatching of request.,Read request,Dispatching a read request.
Microsoft-Windows-StorPort,Information,203,2,,Port,Dispatching of request.,Write request,Dispatching a write request.
Microsoft-Windows-StorPort,Information,204,2,,Port,Dispatching of request.,Read request Paging Read request,Dispatching a read request.
Microsoft-Windows-StorPort,Information,205,2,,Port,Dispatching of request.,Write request Paging Write request,Dispatching a write request.
Microsoft-Windows-StorPort,Information,206,2,,Port,Dispatching of request.,Read request Low memory Read request,Dispatching a read request.
Microsoft-Windows-StorPort,Information,207,2,,Port,Dispatching of request.,Write request Low memory write request,Dispatching a write request.
Microsoft-Windows-StorPort,Information,208,1,,Port,Completion of request.,Read request Write request Paging Read request Paging Write request Low memory Read request Low memory write request,Completing an IO (read/write) request.
Microsoft-Windows-StorPort,Information,209,1,,Port,Retry handling.,Read request Write request Paging Read request Paging Write request Low memory Read request Low memory write request,Retrying an IO (read/write) request.
Microsoft-Windows-StorPort,Information,210,1,,Port,,Flush request,Flush request.
Microsoft-Windows-StorPort,Information,211,1,,Port,Completion of request.,Flush request,Flush request.
Microsoft-Windows-StorPort,Information,212,1,,Port,Dispatching of request.,Device I/O control request,Dispatching an IOCTL.
Microsoft-Windows-StorPort,Information,213,1,,Port,Dispatching of request.,WMI request,Dispatching a WMI request.
Microsoft-Windows-StorPort,Information,214,1,,Port,Completion of request.,Device I/O control request WMI request,Completing a non-read/write request.
Microsoft-Windows-StorPort,Information,215,2,,Port,Dispatching of request.,,Dispatching an adapter power request.
Microsoft-Windows-StorPort,Information,216,2,,Port,Completion of request.,,Completing a unit power request.
Microsoft-Windows-StorPort,Information,217,1,,Port,Dispatching of request.,,Dispatching a PnP request.
Microsoft-Windows-StorPort,Information,218,1,,Port,Completion of request.,,Completing a PnP request.
Microsoft-Windows-StorPort,Information,219,1,,Port,Completion of request.,,Completing a PnP enumeration request.
Microsoft-Windows-StorPort,Information,220,1,,Port,Event Queue related operation.,,Performing a queue-related operation.
Microsoft-Windows-StorPort,Information,221,1,,Port,Dispatching of request.,Pass-Through request Device I/O control request,Dispatching a PassThrough request.
Microsoft-Windows-StorPort,Information,222,1,,Port,,Logo Performance measurement,Request servicing time taken by target device.
Microsoft-Windows-StorPort,Information,223,1,,Port,,Logo Performance measurement,Request servicing time taken by lower driver stack(s).
Microsoft-Windows-StorPort,Information,224,1,,Dpc,Completion of request.,,Dpc completion
Microsoft-Windows-StorPort,Information,225,1,,Port,Start,,Unit power required notification received.
Microsoft-Windows-StorPort,Information,226,1,,Port,Stop,,Unit power required completed.
Microsoft-Windows-StorPort,Information,227,1,,Port,Start,,Unit power not required notification received.
Microsoft-Windows-StorPort,Information,228,1,,Port,Stop,,Unit power not required completed.
Microsoft-Windows-StorPort,Information,229,2,,Port,,,Unit registered with the runtime power framework
Microsoft-Windows-StorPort,Information,230,1,,Port,Start,,Unit idle state notification received.
Microsoft-Windows-StorPort,Information,231,1,,Port,Stop,,Unit idle state notification completed.
Microsoft-Windows-StorPort,Information,232,1,,Port,Start,,Unit active condition notification received.
Microsoft-Windows-StorPort,Information,233,1,,Port,Stop,,Unit active condition notification completed.
Microsoft-Windows-StorPort,Information,234,1,,Port,Start,,Unit idle condition notification received.
Microsoft-Windows-StorPort,Information,235,1,,Port,Stop,,Unit idle condition notification completed.
Microsoft-Windows-StorPort,Information,236,1,,Port,Start,,Adapter power required notification received.
Microsoft-Windows-StorPort,Information,237,1,,Port,Stop,,Adapter power required completed.
Microsoft-Windows-StorPort,Information,238,1,,Port,Start,,Adapter power not required notification received.
Microsoft-Windows-StorPort,Information,239,1,,Port,Stop,,Adapter power not required completed.
Microsoft-Windows-StorPort,Information,240,2,,Port,,,Adapter registered with the runtime power framework
Microsoft-Windows-StorPort,Information,241,1,,Port,Start,,Adapter idle state notification received.
Microsoft-Windows-StorPort,Information,242,1,,Port,Stop,,Adapter idle state notification completed.
Microsoft-Windows-StorPort,Information,243,1,,Port,Start,,Adapter active condition notification received.
Microsoft-Windows-StorPort,Information,244,1,,Port,Stop,,Adapter active condition notification completed.
Microsoft-Windows-StorPort,Information,245,1,,Port,Start,,Adapter idle condition notification received.
Microsoft-Windows-StorPort,Information,246,1,,Port,Stop,,Adapter idle condition notification completed.
Microsoft-Windows-StorPort,Information,247,1,,Port,Event Queue related operation.,,Performing a queue-related operation.
Microsoft-Windows-StorPort,Information,248,1,,Isr,Completion of request.,,Isr completion
Microsoft-Windows-StorPort,Information,250,3,,Port,,,The miniport logged an event.
Microsoft-Windows-StorPort,Information,251,3,,Port,,,The miniport logged an event.
Microsoft-Windows-StorPort,Information,252,3,,Port,,,The miniport logged an event.
Microsoft-Windows-StorPort,Information,253,3,,Port,,,The miniport logged an event.
Microsoft-Windows-StorPort,Information,254,3,,Port,,,The miniport logged an event.
Microsoft-Windows-StorPort,Information,255,3,,Port,,,The miniport logged an event.
Microsoft-Windows-StorPort,Information,256,3,,Port,,,The miniport logged an event.
Microsoft-Windows-StorPort,Information,257,3,,Port,,,The miniport logged an event.
Microsoft-Windows-StorPort,Information,258,3,,Port,,,The miniport logged an event.
Microsoft-Windows-StorPort,Information,259,1,,Port,Stop,,Unit idle state notification queued because the adapter is inactive.
Microsoft-Windows-StorPort,Information,260,1,,Port,Completion of request.,,Completing an adapter power request.
Microsoft-Windows-StorPort,Information,261,1,,Port,,,The idle timeout value for the adapter has changed.
Microsoft-Windows-StorPort,Information,262,1,,Port,Dispatching of request.,,Dispatching a unit power request.
Microsoft-Windows-StorPort,Information,263,1,,Port,,,Unit has performed {CurrentPowerCycleCount} power cycles out of a possible {PotentialPowerCycleCount}.
Microsoft-Windows-StorPort,Information,264,1,,Port,,,Unit idle timeout value has changed from {CurrentD3IdleTimeout} to {NewD3IdleTimeout}.
Microsoft-Windows-StorPort,Information,265,1,,Port,,,Adapter system power hint changed.
Microsoft-Windows-StorPort,Information,267,1,,Port,Start,,Host-initiated unit maintenance time has started.
Microsoft-Windows-StorPort,Information,268,1,,Port,Stop,,Host-initiated unit maintenance time has ended.
Microsoft-Windows-StorPort,Information,269,1,,Port,Completion of request.,Pass-Through request Device I/O control request,Completing a (PassThrough) Protocol Command request.
Microsoft-Windows-StorPort,Information,270,1,,Port,Start,,Unit directed power up notification received.
Microsoft-Windows-StorPort,Information,271,1,,Port,Stop,,Unit directed power up completed.
Microsoft-Windows-StorPort,Information,272,1,,Port,Start,,Unit directed power down notification received.
Microsoft-Windows-StorPort,Information,273,1,,Port,Stop,,Unit directed power down completed.
Microsoft-Windows-StorPort,Information,274,1,,Port,Start,,Adapter directed power up notification received.
Microsoft-Windows-StorPort,Information,275,1,,Port,Stop,,Adapter directed power up completed.
Microsoft-Windows-StorPort,Information,276,1,,Port,Start,,Adapter directed power down notification received.
Microsoft-Windows-StorPort,Information,277,1,,Port,Stop,,Adapter directed power down completed.
Microsoft-Windows-StorPort,Information,400,1,,,Get MFND capabilities.,Multiple Physical Function NVMe Device,Get MFND capabilities.                    Adapter port number: {PortNumber}                    Adapter Guid: {AdapterGuid}                    Miniport driver name: {MiniportName}                    Adapter SerialNumber: {AdapterSerialNumber}                    MFND supported: {MFNDSupported}                    MFND operation mode: {OperationMode}                    MFND operation privilege: {OperationPrivilege}                    Signature: {Signature}                    Major version: {MajorVersion}                    Sub version: {PortNumber}0                    Maximum physical function count: {PortNumber}1                    Available physical function count: {PortNumber}2                    Maximum IO queue pair count: {PortNumber}3                    Available IO queue pair count: {PortNumber}4                    Maximum MSI-X message count: {PortNumber}5                    Available MSI-X message count: {PortNumber}6                    Maximum namespace count: {PortNumber}7                    Available namespace count: {PortNumber}8                    Total NVM storage size: {PortNumber}9                    Available NVM storage size: {AdapterGuid}0                    Storage provision granularity: {AdapterGuid}1                    Total read bandwidth: {AdapterGuid}2                    Available read bandwidth: {AdapterGuid}3                    Total write bandwidth: {AdapterGuid}4                    Available write bandwidth: {AdapterGuid}5                    Total read IOPS: {AdapterGuid}6                    Available read IOPS: {AdapterGuid}7                    Total write IOPS: {AdapterGuid}8                    Available write IOPS: {AdapterGuid}9                    Features: {MiniportName}0                    Maximum supported child controller namespace count: {MiniportName}1
Microsoft-Windows-StorPort,Information,401,1,,,Query MFND child physical function list.,Multiple Physical Function NVMe Device,Query MFND child physical function list.                    Adapter port number: {PortNumber}                    Adapter Guid: {AdapterGuid}                    Miniport driver name: {MiniportName}                    Adapter SerialNumber: {AdapterSerialNumber}                    MFND interface name: {MFNDInterfaceName}                    MFND operation mode: {OperationMode}                    MFND operation privilege: {OperationPrivilege}                    Child physical function count: {ChildPFCount}                    Command status code (SC): {PortNumber}1                    Command status code type (SCT): {PortNumber}2                    NtStatus: {PortNumber}3
Microsoft-Windows-StorPort,Information,402,1,,,Query MFND operation information.,Multiple Physical Function NVMe Device,Query MFND operation information.                    Adapter port number: {PortNumber}                    Adapter Guid: {AdapterGuid}                    Miniport driver name: {MiniportName}                    Adapter SerialNumber: {AdapterSerialNumber}                    MFND interface name: {MFNDInterfaceName}                    MFND operation mode: {OperationMode}                    MFND operation privilege: {OperationPrivilege}                    Command status code (SC): {SC}                    Command status code type (SCT): {SCT}                    NtStatus: {PortNumber}0
Microsoft-Windows-StorPort,Information,403,1,,,Query MFND child physical function property.,Multiple Physical Function NVMe Device,Query MFND child physical function property.                    Adapter port number: {PortNumber}                    Adapter Guid: {AdapterGuid}                    Miniport driver name: {MiniportName}                    Adapter SerialNumber: {AdapterSerialNumber}                    MFND interface name: {MFNDInterfaceName}                    Flags: {Flags}                    Namespace metadata size: {NamespaceMetadataSize}                    Namespace LBA data size: {NamespaceLBADataSize}                    Data protection type: {DataProtectionType}                    Namespace MPIO and Namespace Sharing Capabilities: {PortNumber}0                    Command status code (SC): {PortNumber}1                    Command status code type (SCT): {PortNumber}2                    NtStatus: {PortNumber}3
Microsoft-Windows-StorPort,Information,404,1,,,Query MFND child physical function settings.,Multiple Physical Function NVMe Device,Query MFND child physical function settings.                    Adapter port number: {PortNumber}                    Adapter Guid: {AdapterGuid}                    Miniport driver name: {MiniportName}                    Adapter SerialNumber: {AdapterSerialNumber}                    MFND interface name: {MFNDInterfaceName}                    Flags: {SettingsFlags}                    IO queue pair count: {IoQueuePairCount}                    Interrupt count: {InterruptCount}                    Namespace count: {NamespaceCount}                    Storage provision count: {PortNumber}0                    QoS version: {PortNumber}1                    QoS size: {PortNumber}2                    QoS policy: {PortNumber}3                    Reserve read bandwidth in MBps: {PortNumber}4                    Reserve write bandwidth in MBps: {PortNumber}5                    Limit bandwidth in MBps: {PortNumber}6                    Limit write bandwidth in MBps: {PortNumber}7                    Reserve read IOPS: {PortNumber}8                    Reserve write IOPS: {PortNumber}9                    Limit IOPS: {AdapterGuid}0                    Limit write IOPS: {AdapterGuid}1                    Command status code (SC): {AdapterGuid}2                    Command status code type (SCT): {AdapterGuid}3                    NtStatus: {AdapterGuid}4
Microsoft-Windows-StorPort,Information,405,1,,,Query MFND child physical function admin commands permission.,Multiple Physical Function NVMe Device,Query MFND child physical function admin commands permission.                    Adapter port number: {PortNumber}                    Adapter Guid: {AdapterGuid}                    Miniport driver name: {MiniportName}                    Adapter SerialNumber: {AdapterSerialNumber}                    MFND interface name: {MFNDInterfaceName}                    Command count: {CommandCount}                    Command status code (SC): {SC}                    Command status code type (SCT): {PortNumber}0                    NtStatus: {PortNumber}1
Microsoft-Windows-StorPort,Warning,500,4,,,,,A request timed out for Storport Device (Port = {PortNumber}; Path = {PathID}; Target = {TargetID}; Lun = {LUN}).                    Corresponding Class Disk Device Guid is {ClassDeviceGuid}.
Microsoft-Windows-StorPort,Error,501,3,,Bus reset,OpCodeBusReset,Reset,Bus reset occurred on storport adapter {AdapterGuid} (Port Number: {PortNumber})
Microsoft-Windows-StorPort,Error,502,2,,,,Device state,Storport Device (Port = {PortNumber}; Path = {PathID}; Target = {TargetID}; Lun = {LUN}) was marked unresponsive due to reason : ({MiniportName}1).                    Corresponding Class Disk Device Guid is {ClassDeviceGuid}.
Microsoft-Windows-StorPort,Information,503,2,,,,Device state,Storport Device (Port = {PortNumber}; Path = {PathID}; Target = {TargetID}; Lun = {LUN}) was marked responsive.                    Trigger was {MiniportName}1.                    Corresponding Class Disk Device Guid is {ClassDeviceGuid}.
Microsoft-Windows-StorPort,Information,504,4,,Port,,Read request Write request,Error summary for Storport Device (Port = {PortNumber}; Path = {PathID}; Target = {TargetID}; Lun = {LUN}) whose Corresponding Class Disk Device Guid is {ClassDeviceGuid}:                     There were {PortNumber}5 total errors seen and {PortNumber}9 timeouts.                     The last error seen had opcode {PathID}3 and completed with SrbStatus {PathID}4 and ScsiStatus {PathID}5.                     The sense code was ({PathID}6;{PathID}7;{PathID}8).                     The latency was {PathID}1 ms.
Microsoft-Windows-StorPort,Information,505,5,,Port,,Read request Write request,Performance summary for Storport Device (Port = {PortNumber}; Path = {PathID}; Target = {TargetID}; Lun = {LUN}) whose Corresponding Class Disk Device Guid is {ClassDeviceGuid}:                 Total IO:{PortNumber}8                 For latency buckets of {TargetID}2;                 The IO success counts are {TargetID}3; {TargetID}4; {TargetID}5; {TargetID}6; {TargetID}7; {TargetID}8; {TargetID}9; {LUN}0; {LUN}1; {LUN}2; {LUN}3; {LUN}4.                 The IO failed counts are {LUN}5; {LUN}6; {LUN}7; {LUN}8; {LUN}9; {ClassDeviceGuid}0; {ClassDeviceGuid}1; {ClassDeviceGuid}2; {ClassDeviceGuid}3; {ClassDeviceGuid}4; {ClassDeviceGuid}5; {ClassDeviceGuid}6.                 The IO total latency (in 100ns) are {ClassDeviceGuid}7; {ClassDeviceGuid}8; {ClassDeviceGuid}9; {AdapterGuid}0; {AdapterGuid}1; {AdapterGuid}2; {AdapterGuid}3; {AdapterGuid}4; {AdapterGuid}5; {AdapterGuid}6; {AdapterGuid}7; {AdapterGuid}8.                 Total Bytes Read:{AdapterGuid}9                 Total Bytes Written:{BusType}0
Microsoft-Windows-StorPort,Information,506,3,,Port,,Device state,QoS summary for Storport Device (Port = {PortNumber}; Path = {PathID}; Target = {TargetID}; Lun = {LUN}) whose Corresponding Class Disk Device Guid is {ClassDeviceGuid}:                    Number of QoS requests that exceeded {MiniportName}3 seconds is {MiniportName}2 in this period.                    SW timeout count for Unit and Adapter queues were {MiniportName}4 and {MiniportName}5 respectively during this period.                    Max Depth of Unit and Adapter queues at the time of SW timeout were {MiniportName}7 and {MiniportName}8 respectively.                    HwTimeout count was {MiniportName}6 in this period.
Microsoft-Windows-StorPort,Error,507,2,,,,,Miniport bug detected for {MiniportName} : A pending request was not completed by miniport for below storage device even after successful reset operation.                    Storport Device (Port = {PortNumber}; Path = {PathID}; Target = {TargetID}; Lun = {LUN}).                    Corresponding Class Disk Device Guid is {ClassDeviceGuid}.
Microsoft-Windows-StorPort,Error,508,1,,,,,Miniport bug detected for {MiniportName} : A pending request was not completed by miniport for below storage device even after successful abort operation.                    Storport Device (Port = {PortNumber}; Path = {Bus}; Target = {Target}; Lun = {LUN}).                    Corresponding Class Disk Device Guid is {ClassDeviceGuid}.
Microsoft-Windows-StorPort,Error,509,1,,,,,An abort request timed out for Storport Device (Port = {PortNumber}; Path = {Bus}; Target = {Target}; Lun = {LUN}).                    Corresponding Class Disk Device Guid is {ClassDeviceGuid}.
Microsoft-Windows-StorPort,Information,510,4,,Port,,Device state,SMART statistics for Storport Device (Port = {PortNumber}; Path = {PathID}; Target = {TargetID}; Lun = {LUN}).                    Corresponding Class Disk Device Guid is {ClassDeviceGuid}.
Microsoft-Windows-StorPort,Information,511,5,,Port,,Device state,ATA Device Statistics Logs for Storport Device (Port = {PortNumber}; Path = {PathID}; Target = {TargetID}; Lun = {LUN}).                    Corresponding Class Disk Device Guid is {ClassDeviceGuid}.
Microsoft-Windows-StorPort,Information,512,6,,Port,,Device state,NVMe Health Information Log for Storport Device (Port = {PortNumber}; Path = {PathID}; Target = {TargetID}; Lun = {LUN}).                    Corresponding Class Disk Device Guid is {ClassDeviceGuid}.
Microsoft-Windows-StorPort,Information,513,1,,Port,,,Host Memory Buffer Allocation for {AdapterName} {AdapterName}0.                    Failure Reason: {AdapterName}1                    Allocation Policy: {AllocationPolicy}                    Attemped to Allocate: 	{TargetAllocationSizeInBytes} bytes                    Actually Allocated: 	{ActualAllocationSizeInBytes} bytes                    Device Minimum: 	{DeviceMinSizeInBytes} bytes                    Device Preferred: 		{DevicePreferredSizeInBytes} bytes                    Policy Maximum: 		{PolicyMaxInBytes} bytes
Microsoft-Windows-StorPort,Error,514,3,,Port,,Shingled Magnetic Recording Drive Operations,Detected SMR out of order Write
Microsoft-Windows-StorPort,Information,515,3,,Port,,Shingled Magnetic Recording Drive Operations,Dispatching SMR Reset Write Pointer Request
Microsoft-Windows-StorPort,Error,516,3,,Port,,,The miniport logged an event.
Microsoft-Windows-StorPort,Error,517,3,,Port,,,The miniport logged an event.
Microsoft-Windows-StorPort,Error,518,3,,Port,,,The miniport logged an event.
Microsoft-Windows-StorPort,Error,519,3,,Port,,,The miniport logged an event.
Microsoft-Windows-StorPort,Error,520,3,,Port,,,The miniport logged an event.
Microsoft-Windows-StorPort,Error,521,3,,Port,,,The miniport logged an event.
Microsoft-Windows-StorPort,Error,522,3,,Port,,,The miniport logged an event.
Microsoft-Windows-StorPort,Error,523,3,,Port,,,The miniport logged an event.
Microsoft-Windows-StorPort,Error,524,3,,Port,,,The miniport logged an event.
Microsoft-Windows-StorPort,Warning,525,3,,Port,,,The miniport logged an event.
Microsoft-Windows-StorPort,Warning,526,3,,Port,,,The miniport logged an event.
Microsoft-Windows-StorPort,Warning,527,3,,Port,,,The miniport logged an event.
Microsoft-Windows-StorPort,Warning,528,3,,Port,,,The miniport logged an event.
Microsoft-Windows-StorPort,Warning,529,3,,Port,,,The miniport logged an event.
Microsoft-Windows-StorPort,Warning,530,3,,Port,,,The miniport logged an event.
Microsoft-Windows-StorPort,Warning,531,3,,Port,,,The miniport logged an event.
Microsoft-Windows-StorPort,Warning,532,3,,Port,,,The miniport logged an event.
Microsoft-Windows-StorPort,Warning,533,3,,Port,,,The miniport logged an event.
Microsoft-Windows-StorPort,Error,534,4,,Port,,,The miniport logged an event.
Microsoft-Windows-StorPort,Error,535,3,,Device potentially failed.,Device potentially failed.,PortNotification,Miniport notifies device(Port = {AdapterInterfaceType}; Path = {Bus}; Target = {Device}; Lun = {Function}) potentially failed.                    Corresponding Class Disk Device Guid: {PortNumber}                    Adapter Guid: {PathID}                    Miniport driver name: {TargetID}                    VendorId: {LUN}                    ProductId: {ClassDeviceGuid}                    SerialNumber: {AdapterInterfaceType}0                    AdapterSerialNumber: {AdapterInterfaceType}1                    Fault Code: {AdapterInterfaceType}2                    Fault Description: {AdapterInterfaceType}3
