Provider,Level,Event ID,Version,Channel,Task,Opcode,Keyword,Message
Microsoft-Windows-RemoteDesktopServices-RdpCoreTS,Warning,1,0,Microsoft-Windows-RemoteDesktopServices-RdpCoreTS/Admin,RDP Stack,Initialize,,The {PluginName} failed to initialize. Verify that the server is correctly configured. A restart of the system may be needed.
Microsoft-Windows-RemoteDesktopServices-RdpCoreTS,Information,2,0,Microsoft-Windows-RemoteDesktopServices-RdpCoreTS/Admin,RDP Stack,Initialize,,Remote Desktop Protocol will use {PluginName} to connect to the client computer. {PluginName} is being used based on the server configuration; client configuration; and network connection.
Microsoft-Windows-RemoteDesktopServices-RdpCoreTS,Warning,3,0,Microsoft-Windows-RemoteDesktopServices-RdpCoreTS/Admin,RemoteFX module,Initialize,,The RemoteFX module failed to initialize. Verify that the server is correctly configured. A restart of the system may be needed. The relevant status code was {StatusCode}.
Microsoft-Windows-RemoteDesktopServices-RdpCoreTS,Critical,4,0,Microsoft-Windows-RemoteDesktopServices-RdpCoreTS/Admin,RemoteFX module,Initialize,,The RemoteFX module failed to initialize. Verify that the server is correctly configured. A restart of the system may be needed. The relevant status code was {StatusCode}.
Microsoft-Windows-RemoteDesktopServices-RdpCoreTS,Warning,5,0,Microsoft-Windows-RemoteDesktopServices-RdpCoreTS/Admin,RemoteFX module,Initialize,,The client computer does not support RemoteFX. The connection will be made with the RDP Graphics. The relevant status code was {StatusCode}.
Microsoft-Windows-RemoteDesktopServices-RdpCoreTS,Warning,6,0,Microsoft-Windows-RemoteDesktopServices-RdpCoreTS/Admin,RemoteFX module,Initialize,,The resolution requested by the remote client is not supported by RemoteFX. The connection will be made with RemoteFX using a supported resolution. Resolution requested by the client: {RequestedMode}. Resolution applied: {AppliedMode}.
Microsoft-Windows-RemoteDesktopServices-RdpCoreTS,Critical,7,0,Microsoft-Windows-RemoteDesktopServices-RdpCoreTS/Admin,RemoteFX module,Initialize,,
