Provider|Event ID|Channel|Message
Microsoft-Windows-WPD-MTPBT|100|Analytic|Write MTP BT Packet to data channel
Microsoft-Windows-WPD-MTPBT|101|Analytic|Write MTP BT Packet to event channel
Microsoft-Windows-WPD-MTPBT|102|Analytic|Read MTP BT Packet from data channel
Microsoft-Windows-WPD-MTPBT|103|Analytic|Read MTP BT Packet from event channel
Microsoft-Windows-WPD-MTPBT|104|Analytic|Read MTP BT Data Packet
Microsoft-Windows-WPD-MTPBT|105|Analytic|Received BT Device Event
Microsoft-Windows-WPD-MTPBT|106|Analytic|Received BT Unexpected header on data channel
Microsoft-Windows-WPD-MTPBT|107|Analytic|Received BT Unexpected header on event channel
