Provider,Level,Event ID,Version,Channel,Task,Opcode,Keyword,Message
Microsoft-Windows-MSDTC,,3221229829,0,,,,,MS DTC is unable to communicate with MS DTC on a remote system. No common RPC protocol is supported between the two systems. Please ensure that one or more of the following RPC protocols are common to both systems: TCP/IP; SPX; or NetBEUI.  Error Specifics: {param1}
Microsoft-Windows-MSDTC,,3221229830,0,,,,,The MS DTC Connection Manager is unable to register with RPC to use one of LRPC; TCP/IP; or UDP/IP. Please ensure that RPC is configured properly. If "ServerTcpPort" registry key is configured(DWORD value under the HKEY_LOCAL_MACHINE\Software\Microsoft\MSDTC for local DTC instance or under cluster hive for clustered DTC instance); please verify if the configured port is valid and the port is not already in use by a different component. Error Specifics:{param1}
Microsoft-Windows-MSDTC,,3221229831,0,,,,,MS DTC is unable to communicate with MS DTC on a remote system. MS DTC on the primary system established an RPC binding with MS DTC on the secondary system. However; the secondary system did not create the reverse RPC binding to the primary MS DTC system before the timeout period expired. Please ensure that there is network connectivity between the two systems.  Error Specifics:{param1}
Microsoft-Windows-MSDTC,,3221229832,0,,,,,MS DTC was not able to allocate a console.
Microsoft-Windows-MSDTC,,3221229833,0,,,,,An incompletely initialized MS DTC log file was detected. After ensuring that all Resource Managers coordinated by MS DTC have no indoubt transactions; please run msdtc -resetlog to reset the log file.
Microsoft-Windows-MSDTC,,3221229834,0,,,,,Illegal transition caused fatal error: Event={param1} File={param2} Line={param3}.
Microsoft-Windows-MSDTC,,3221229835,0,,,,,Out of memory caused fatal error: Object={param1} File={param2} Line={param3}.
Microsoft-Windows-MSDTC,,3221229839,0,,,,,Unexpected event occurred on synchronization object: File={param1} Line={param2}.
Microsoft-Windows-MSDTC,,3221229840,0,,,,,Unexpected error occured in the MS DTC XA Transaction Manager : File={param1} Line={param2}.
Microsoft-Windows-MSDTC,,3221229842,0,,,,,MS DTC was unable to bind to the TIP socket. This failure may have occurred because some other application is using the TIP socket. MS DTC will continue to start but TIP features will be unavailable. If you require TIP; please make the socket available and restart MS DTC.
Microsoft-Windows-MSDTC,,3221229843,0,,,,,The MS DTC Transaction Manager sent a TIP "PULL COMMAND" to another transaction manager and received a TIP "ERROR COMMAND" in response. Transaction specifics: External Transaction Manager Id "{param1}"; External Transaction URL {param2}; MS DTC TIP Transaction URL "{param3}".
Microsoft-Windows-MSDTC,,3221229844,0,,,,,The MS DTC Transaction Manager sent a TIP "PULL COMMAND" to another transaction manager and received an unknown or unexpected TIP command ({param1}) in response. Transaction specifics: External Transaction Manager Id {param2}; External Transaction URL "{param3}"; MS DTC TIP Transaction URL "{param4}".
Microsoft-Windows-MSDTC,,3221229845,0,,,,,MS DTC does not currently support either TIP or XA on 64 bit platforms. MS DTC will continue to start but TIP and XA features will be unavailable.
Microsoft-Windows-MSDTC,,3221229846,0,,,,,The MS DTC Transaction Manager received a TIP "ERROR COMMAND" for an Active transaction that was created with the "BEGIN COMMAND" and is being controlled by another transaction manager. The transaction has been aborted. Transaction specifics: External Transaction Manager URL "{param1}"; MS DTC TIP Transaction URL "{param2}".
Microsoft-Windows-MSDTC,,3221229847,0,,,,,The MS DTC Transaction Manager received an unknown or unexpected TIP command ({param1}) for an Active transaction that was created with the "BEGIN COMMAND" and is being controlled by another transaction manager. The transaction has been aborted. Transaction specifics: External Transaction Manager Id "{param2}"; MS DTC TIP Transaction URL "{param2}".
Microsoft-Windows-MSDTC,,3221229848,0,,,,,The application could not connect to MSDTC because of insufficient permissions. Please make sure that the identity under which the application is running has permission to access the cluster. Please refer to MSCS documentation on how to grant permissions. Error Specifics: {param1}
Microsoft-Windows-MSDTC,,3221229849,0,,,,,Running "msdtc -remove" is no longer supported.  To un-install MSDTC please contact product support. To configure this system to use a remote MSDTC as the coordinator please use the Component Services Explorer.
Microsoft-Windows-MSDTC,,3221229850,0,,,,,MS DTC setup has determined that the existing cluster resource for MS DTC is not configured correctly. Setup cannot continue to upgrade the installation.  Please contact product support or delete the existing MS DTC resource and re-run setup via comclust.exe. Error Specifics: {param1}
Microsoft-Windows-MSDTC,,3221229851,0,,,,,MS DTC setup has determined that the existing cluster resource for MS DTC is of a newer version. Setup cannot continue to upgrade the installation. Error Specifics: {param1}
Microsoft-Windows-MSDTC,,3221229852,0,,,,,MS DTC setup has determined that the installation of MS DTC on this node used to be a part of cluster that had a newer version of MS DTC installed. Setup cannot continue to upgrade the installation. Error Specifics: {param1}
Microsoft-Windows-MSDTC,,3221229853,0,,,,,MS DTC was unable to determine the version of the data associated with cluster support in the local registry.  MS DTC cannot continue to startup.  Please contact Microsoft Product Support. Error Specifics: {param1}
Microsoft-Windows-MSDTC,,3221229854,0,,,,,MS DTC was unable to determine the version of the data associated with MS DTC cluster resource.  MS DTC cannot continue to startup.  Please contact Microsoft Product Support. Error Specifics: {param1}
Microsoft-Windows-MSDTC,,3221229855,0,,,,,MS DTC was unable to determine the state of the cluster service on this machine.  MS DTC cannot continue to startup.  Please contact Microsoft Product Support. Error Specifics: {param1}
Microsoft-Windows-MSDTC,,3221229856,0,,,,,MS DTC was unable to start because the installation was not configured to run on a cluster.  Please create a MS DTC resource through cluster administrator. Error Specifics: {param1}
Microsoft-Windows-MSDTC,,3221229857,0,,,,,MS DTC cannot start on this cluster node because the MS DTC resource is currently owned by another node in the cluster. Error Specifics: {param1}
Microsoft-Windows-MSDTC,,3221229858,0,,,,,MS DTC cannot start because it failed to initialize the log file for its first usage after a cluster install. Please try to restart MS DTC.  If the problem persists please contact Microsoft Product Support. Error Specifics: {param1}
Microsoft-Windows-MSDTC,,3221229859,0,,,,,MS DTC setup timed out while waiting for another copy of MS DTC setup to finish populating the shared cluster registry. Please re-run comclus.exe on this node when the other setup completes.  If there is not other MS DTC setup running then please delete the MS DTC cluster resource and re-run comclust.exe. Error Specifics: {param1}
Microsoft-Windows-MSDTC,,3221229860,0,,,,,"msdtc -resetlog" did not succeed because the log file is located on a shared disk owned by another node.
Microsoft-Windows-MSDTC,,3221229861,0,,,,,MS DTC setup failed to populate the shared cluster registry. The DTC resource will not be able to come online.Error Specifics: {param1}
Microsoft-Windows-MSDTC,,3221229862,0,,,,,MS DTC setup failed to populate the shared cluster registry with information about MSDTC's log.The DTC resource will not be able to come online.Error Specifics: {param1}
Microsoft-Windows-MSDTC,,3221229863,0,,,,,MS DTC setup failed to populate the local registry with information from the shared cluster registry. Applications that use MSDTC may not work correctly as a result of this error. Error Specifics: {param1}
Microsoft-Windows-MSDTC,,3221229864,0,,,,,MS DTC setup was unable to turn off auto start for the MSDTC service. Error Specifics: {param1}
Microsoft-Windows-MSDTC,,3221229865,0,,,,,Information about the MSDTC resource has not been configured correctly in the shared cluster registry. Error Specifics: {param1}
Microsoft-Windows-MSDTC,,3221229866,0,,,,,MS DTC's log information has not been configured correctly in the shared cluster registry. Error Specifics: {param1}
Microsoft-Windows-MSDTC,,3221229867,0,,,,,MSDTC detected that MSDTC related information in the local registry is different from that in the shared cluster registry. Error Specifics: {param1}
Microsoft-Windows-MSDTC,,3221229868,0,,,,,The MSDTC resource does not have the required dependency on a resource of type Network Name. Error Specifics: {param1}
Microsoft-Windows-MSDTC,,3221229869,0,,,,,The MSDTC resource does not have the required dependency on a resource of type Physical Disk. Error Specifics: {param1}
Microsoft-Windows-MSDTC,,3221229870,0,,,,,MS DTC's cluster resource dll attempted to wait on an internal event. This wait failed. The MS DTC resource will not be able to come online because of this error. If the problem persists please contact Microsoft Product Support. Error Specifics: {param1}
Microsoft-Windows-MSDTC,,3221229871,0,,,,,Could not establish connection to trace transaction.
Microsoft-Windows-MSDTC,,3221229872,0,,,,,No transaction is selected.
Microsoft-Windows-MSDTC,,3221229873,0,,,,,Transaction not found.
Microsoft-Windows-MSDTC,,3221229874,0,,,,,The version of the transaction manager is not compatible for this feature.
Microsoft-Windows-MSDTC,,3221229875,0,,,,,The attempt to dump the transaction to a trace file failed.
Microsoft-Windows-MSDTC,,3221229876,0,,,,,MS DTC Tracing infrastructure : the initialization of the tracing infrastructure failed. Internal Information : {param1}.
Microsoft-Windows-MSDTC,,3221229877,0,,,,,MS DTC Tracing infrastructure : the attempt to create a new trace session failed. Internal Information : {param1}.
Microsoft-Windows-MSDTC,,3221229878,0,,,,,MS DTC Tracing infrastructure : the attempt to stop the existing trace session failed. Internal Information : {param1}.
Microsoft-Windows-MSDTC,,3221229879,0,,,,,MS DTC Tracing infrastructure : the attempt to flush the existing trace data failed. Internal Information : {param1}.
Microsoft-Windows-MSDTC,,3221229880,0,,,,,MS DTC Tracing infrastructure : the attempt to update the maximum buffer count of the existing trace session failed. Internal Information : {param1}.
Microsoft-Windows-MSDTC,,3221229881,0,,,,,MS DTC Tracing infrastructure : the infrastructure has reported that the number of trace events that have been lost until now is equal to {param1}.
Microsoft-Windows-MSDTC,,3221229882,0,,,,,MS DTC Tracing infrastructure : the thread launched to update the trace settings has failed. Any changes to the trace settings made using the "Tracing Options" dialog box might not take the desired effect. Internal Information : {param1}.
Microsoft-Windows-MSDTC,,3221229883,0,,,,,MS DTC Tracing infrastructure : the attempt to set the trace specific registry settings failed. Any tracing specific functionality will be disabled. Internal Information : {param1}.
Microsoft-Windows-MSDTC,,3221229884,0,,,,,Failed to create a new trace session.
Microsoft-Windows-MSDTC,,3221229885,0,,,,,Failed to stop the existing trace session.
Microsoft-Windows-MSDTC,,3221229886,0,,,,,Failed to flush the existing trace data.
Microsoft-Windows-MSDTC,,3221229887,0,,,,,Failed to update the maximum buffer count of the existing trace session.
Microsoft-Windows-MSDTC,,3221229888,0,,,,,Failed to update all the trace settings in the registry.
Microsoft-Windows-MSDTC,,3221229889,0,,,,,Failed to load all the trace settings from the registry.
Microsoft-Windows-MSDTC,,3221229890,0,,,,,MS DTC Transaction Manager start failed. GetSecurityConfiguration returned error {param1}.
Microsoft-Windows-MSDTC,,3221229891,0,,,,,MS DTC failed to load the system restore information. As a result; the service is exiting. Please try restarting the service; if the service fails to start; contact product support. Error Specifics: {param1}
Microsoft-Windows-MSDTC,,3221229892,0,,,,,MS DTC failed to process a system restore event. As a result; the service is exiting. Please try restarting the service; if the service fails to start; contact product support. Error Specifics: {param1}
Microsoft-Windows-MSDTC,,3221229893,0,,,,,MS DTC failed to save the system restore information. As a result; the service is exiting. Please try restarting the service; if the service fails to start; contact product support. Error Specifics: {param1}
Microsoft-Windows-MSDTC,,1073746246,0,,,,,MS DTC has processed a system restore event. As a result the transaction log has been reset and the identity of the transaction manager has been changed.
Microsoft-Windows-MSDTC,,3221229896,0,,,,,MS DTC Tracing infrastructure : the attempt to create the trace directory failed. Any tracing specific functionality will be disabled. Internal Information : {param1}.
Microsoft-Windows-MSDTC,,3221229897,0,,,,,MS DTC Tracing infrastructure : the infrastructure has reported that an attempt to trace an event has failed cause of lack of enough buffer space. The tracing infrastructure will retry tracing this event. The total number of times this has happened so far is equal to {param1}. Increasing the max number of memory buffers might rectify the situation.
Microsoft-Windows-MSDTC,,3221229898,0,,,,,Failed to read the needed name objects from the registry. Error Specifics: {param1}
Microsoft-Windows-MSDTC,,3221229899,0,,,,,Failed to initialize the needed name objects. Error Specifics: {param1}
Microsoft-Windows-MSDTC,,3221229900,0,,,,,Failed to stop MSDTC service or one of its dependent services. Error Specifics: {param1}
Microsoft-Windows-MSDTC,,3221229901,0,,,,,Failed to set the security attributes on the MS DTC service. Internal Information : {param1}.
Microsoft-Windows-MSDTC,,3221229903,0,,,,,Failed to stop the MS DTC service. Internal Information : {param1}.
Microsoft-Windows-MSDTC,,3221229904,0,,,,,Failed to restart the MS DTC service. Internal Information : {param1}.
Microsoft-Windows-MSDTC,,3221229905,0,,,,,The MS DTC Transaction Manager is in an inconsistent state and cannot proceed.  An unknown message type was received.  Please contact Microsoft Product Support. {param1}
Microsoft-Windows-MSDTC,,3221229906,0,,,,,The MS DTC Transaction Manager is in an inconsistent state and cannot proceed.  An incorrect message length was received.  Please contact Microsoft Product Support. {param1}
Microsoft-Windows-MSDTC,,3221229907,0,,,,,The MS DTC Transaction Manager is in an inconsistent state and cannot proceed.  A bad message value was received.  Please contact Microsoft Product Support. {param1}
Microsoft-Windows-MSDTC,,3221229908,0,,,,,The MS DTC Transaction Manager is in an inconsistent state and cannot proceed.  An unexpected message type was received.  Please contact Microsoft Product Support. {param1}
Microsoft-Windows-MSDTC,,3221229909,0,,,,,The account that the MS DTC service is running under is invalid. This can happen if the service account information has been changed using the Services snap-in in Microsoft Management Console (MMC). MS DTC service will continue to start. Please make sure that the MS DTC service account information is updated using the Component Services Explorer.
Microsoft-Windows-MSDTC,,3221229910,0,,,,,Failed to set the MS DTC service account information in the registry. Internal Information : {param1}.
Microsoft-Windows-MSDTC,,3221229911,0,,,,,Failed to verify MS DTC service account information. Internal Information : {param1}.
Microsoft-Windows-MSDTC,,3221229912,0,,,,,The MS DTC Service is terminating because it didnt startup in a timely manner.  This may be because MS DTC took too long to recover its log file.  Try increasing the startup timeout by specifying a larger "MaxRecoveryTimePerMbInMinutes" DWORD value under the HKEY_LOCAL_MACHINE\Software\Microsoft\MSDTC registry key.  The default for this value is 3 (minutes). Debugging context follows: {param1}
Microsoft-Windows-MSDTC,,3221229913,0,,,,,A MS DTC component has encountered an internal error. The process is being terminated. Error Specifics: {param1}
Microsoft-Windows-MSDTC,,3221229914,0,,,,,MS DTC was unable to start because this version of dtc is less than the least valid version allowable specified in the cluster database. This can happen if a higher incompatible version of MS DTC was installed on another node of the cluster. Error Specifics: {param1}
Microsoft-Windows-MSDTC,,3221229915,0,,,,,MS DTC was unable to start because this version of dtc is not compatible with the version of MS DTC installed on another node of the cluster. This can happen if an incompatible version of MS DTC was installed on another node of the cluster. Error Specifics: {param1}
Microsoft-Windows-MSDTC,,3221229916,0,,,,,The XA Transaction Manager is in an inconsistent state and cannot proceed. XA transactions will not take place. Please contact Microsoft Product Support. {param1}
Microsoft-Windows-MSDTC,,3221229917,0,,,,,The XA Transaction Manager cannot load the requested XA Dll ({param1}) since a registry entry is required for this operation. Please create a string value in the registry under HKLM\Software\Microsoft\MSDTC\XADLL where the value name is the name of the dll in the format dllname.dll and the value is the full path of the Dll. If you are not sure about the name or path of your XA Dll then please check the documentation for your XA provider. If this machine is part of a cluster please note that this registry entry needs to be made for each node in the cluster. {param2}
Microsoft-Windows-MSDTC,,3221229918,0,,,,,Entering MSDTC log storage warning limits.
Microsoft-Windows-MSDTC,,1073746271,0,,,,,Leaving MSDTC log storage warning limits.
Microsoft-Windows-MSDTC,,3221229920,0,,,,,KTMRM service failed to load the system restore information. As a result; the service is exiting. Please try restarting the service; if the service fails to start; contact product support. Error Specifics: {param1}
Microsoft-Windows-MSDTC,,3221229921,0,,,,,KTMRM service failed to process a system restore. As a result; the service is exiting. Please try restarting the service; if the service fails to start; contact product support. Error Specifics: {param1}
Microsoft-Windows-MSDTC,,3221229924,0,,,,,Attempt to freeze the transaction manager failed. Error Specifics: {param1}
Microsoft-Windows-MSDTC,,3221229925,0,,,,,Attempt to thaw the transaction manager failed. Error Specifics: {param1}
Microsoft-Windows-MSDTC,,3221229926,0,,,,,Failed to prepare MSDTC for imaging. Sysprep phase: "{param1}" failed with error: {param2}
Microsoft-Windows-MSDTC,,3221229927,0,,,,,Unexpected error (0x{param1}!%08x!) when connecting to the Kernel Transaction Manager.
Microsoft-Windows-MSDTC,,3221229928,0,,,,,Unable to create a communication channel to the Kernel Transaction Manager.  The attempt failed with error: 0x{param1}!%08x!
Microsoft-Windows-MSDTC,,3221229929,0,,,,,MSDTC was unable to migrate its log during Windows upgrade. The attempt failed with error: {param1}.
Microsoft-Windows-MSDTC,,3221229930,0,,,,,MSDTC encountered an error during migration of contact identifiers. The attempt failed with error: {param1}.
Microsoft-Windows-MSDTC,,3221229931,0,,,,,MSDTC encountered an error during Windows upgrade. Error specifics: {param1}.
Microsoft-Windows-MSDTC,,3221229932,0,,,,,The KtmRm service has encountered an internal error. The service is being shutdown. Error Specifics: {param1}
Microsoft-Windows-MSDTC,,3221229933,0,,,,,The MSDTC service cannot start because its contact identifiers are either missing; inaccessible; or corrupt. Running 'msdtc -uninstall' and then 'msdtc -install' from the command prompt will fix the problem. Note: Running 'msdtc -uninstall' will result in the system losing all MSDTC configuration information. Error Specifics: {param1}
Microsoft-Windows-MSDTC,,1073795072,0,,,,,XACT_S_ASYNC
Microsoft-Windows-MSDTC,,3221278720,0,,,,,XACT_E_ALREADYOTHERSINGLEPHASE
Microsoft-Windows-MSDTC,,1073795073,0,,,,,XACT_S_DEFECT
Microsoft-Windows-MSDTC,,3221278721,0,,,,,XACT_E_CANTRETAIN
Microsoft-Windows-MSDTC,,1073795074,0,,,,,XACT_S_READONLY
Microsoft-Windows-MSDTC,,3221278722,0,,,,,XACT_E_COMMITFAILED
Microsoft-Windows-MSDTC,,1073795075,0,,,,,XACT_S_SOMENORETAIN
Microsoft-Windows-MSDTC,,3221278723,0,,,,,XACT_E_COMMITPREVENTED
Microsoft-Windows-MSDTC,,1073795076,0,,,,,XACT_S_OKINFORM
Microsoft-Windows-MSDTC,,2147536900,0,,,,,The maximum number of asynchronous checkpoints has been exceeded.
Microsoft-Windows-MSDTC,,3221278724,0,,,,,XACT_E_HEURISTICABORT
Microsoft-Windows-MSDTC,,1073795077,0,,,,,XACT_S_MADECHANGESCONTENT
Microsoft-Windows-MSDTC,,2147536901,0,,,,,The maximum number of log buffers in use has been reached.
Microsoft-Windows-MSDTC,,3221278725,0,,,,,XACT_E_HEURISTICCOMMIT
Microsoft-Windows-MSDTC,,1073795078,0,,,,,XACT_S_MADECHANGESINFORM
Microsoft-Windows-MSDTC,,2147536902,0,,,,,Cannot stop MS DTC. The user interface is not connected to the MS DTC service.
Microsoft-Windows-MSDTC,,3221278726,0,,,,,XACT_E_HEURISTICDAMAGE
Microsoft-Windows-MSDTC,,1073795079,0,,,,,XACT_S_ALLNORETAIN
Microsoft-Windows-MSDTC,,2147536903,0,,,,,Cannot start MS DTC. The user interface is not connected to the MS DTC service.
Microsoft-Windows-MSDTC,,3221278727,0,,,,,XACT_E_HEURISTICDANGER
Microsoft-Windows-MSDTC,,1073795080,0,,,,,XACT_S_ABORTING
Microsoft-Windows-MSDTC,,2147536904,0,,,,,MS DTC detected dirty log pages on recovery; and is reconstructing state from other pages
Microsoft-Windows-MSDTC,,3221278728,0,,,,,XACT_E_ISOLATIONLEVEL
Microsoft-Windows-MSDTC,,1073795081,0,,,,,XACT_S_SINGLEPHASE
Microsoft-Windows-MSDTC,,2147536905,0,,,,,MS DTC's attempt to check if the machine is a Domain Controller failed. MS DTC will continue to function; but may use incorrect security settings. Error Specifics: {param1}
Microsoft-Windows-MSDTC,,3221278729,0,,,,,XACT_E_NOASYNC
Microsoft-Windows-MSDTC,,3221278730,0,,,,,XACT_E_NOENLIST
Microsoft-Windows-MSDTC,,3221278731,0,,,,,XACT_E_NOISORETAIN
Microsoft-Windows-MSDTC,,3221278732,0,,,,,XACT_E_NORESOURCE
Microsoft-Windows-MSDTC,,3221278733,0,,,,,XACT_E_NOTCURRENT
Microsoft-Windows-MSDTC,,3221278734,0,,,,,XACT_E_NOTRANSACTION
Microsoft-Windows-MSDTC,,3221278735,0,,,,,XACT_E_NOTSUPPORTED
Microsoft-Windows-MSDTC,,1073795088,0,,,,,XACT_S_LASTRESOURCEMANAGER
Microsoft-Windows-MSDTC,,3221278736,0,,,,,XACT_E_UNKNOWNRMGRID
Microsoft-Windows-MSDTC,,3221278737,0,,,,,XACT_E_WRONGSTATE
Microsoft-Windows-MSDTC,,3221278738,0,,,,,XACT_E_WRONGUOW
Microsoft-Windows-MSDTC,,2147536915,0,,,,,Received unknown connection manager message type: File={param1} Line={param2}.
Microsoft-Windows-MSDTC,,3221278739,0,,,,,XACT_E_XTIONEXISTS
Microsoft-Windows-MSDTC,,3221278740,0,,,,,XACT_E_NOIMPORTOBJECT
Microsoft-Windows-MSDTC,,3221278741,0,,,,,XACT_E_INVALIDCOOKIE
Microsoft-Windows-MSDTC,,3221278742,0,,,,,XACT_E_INDOUBT
Microsoft-Windows-MSDTC,,3221278743,0,,,,,XACT_E_NOTIMEOUT
Microsoft-Windows-MSDTC,,2147536920,0,,,,,The MS DTC XA Transaction Manager called the XA resource manager's xa_rollback function. The call to the xa_rollback function failed with an unexpected return code ({param3}): File={param1} Line={param2}.
Microsoft-Windows-MSDTC,,3221278744,0,,,,,XACT_E_ALREADYINPROGRESS
Microsoft-Windows-MSDTC,,3221278745,0,,,,,XACT_E_ABORTED
Microsoft-Windows-MSDTC,,2147536922,0,,,,,The MS DTC XA Transaction Manager called the XA resource manager's xa_commit function. The call to the xa_commit function failed with an unexpected return code ({param3}): File={param1} Line={param2}.
Microsoft-Windows-MSDTC,,3221278746,0,,,,,XACT_E_LOGFULL
Microsoft-Windows-MSDTC,,3221278747,0,,,,,XACT_E_TMNOTAVAILABLE
Microsoft-Windows-MSDTC,,3221278748,0,,,,,XACT_E_CONNECTION_DOWN
Microsoft-Windows-MSDTC,,3221278749,0,,,,,XACT_E_CONNECTION_DENIED
Microsoft-Windows-MSDTC,,3221278750,0,,,,,XACT_E_REENLISTTIMEOUT
Microsoft-Windows-MSDTC,,3221278751,0,,,,,XACT_E_TIP_CONNECT_FAILED
Microsoft-Windows-MSDTC,,3221278752,0,,,,,XACT_E_TIP_PROTOCOL_ERROR
Microsoft-Windows-MSDTC,,2147536929,0,,,,,The MS DTC XA Transaction Manager called the XA resource manager's xa_open function. The call to the xa_open function failed with an unexpected return code: File={param1} Line={param2}.
Microsoft-Windows-MSDTC,,3221278753,0,,,,,XACT_E_TIP_PULL_FAILED
Microsoft-Windows-MSDTC,,1073795106,0,,,,,Copyright (c) 2013 Microsoft. All rights reserved.
Microsoft-Windows-MSDTC,,3221278754,0,,,,,XACT_E_DEST_TMNOTAVAILABLE
Microsoft-Windows-MSDTC,,1073795107,0,,,,,DTC Security Configuration values (OFF = 0 and ON = 1):  Network Administration of Transactions = {param1};  Network Clients = {param2};   Inbound Distributed Transactions using Native MSDTC Protocol = {param3};      Outbound Distributed Transactions using Native MSDTC Protocol = {param4};   Transaction Internet Protocol (TIP) = {param5};   XA Transactions = {param6};   SNA LU 6.2 Transactions = {param7}
Microsoft-Windows-MSDTC,,3221278755,0,,,,,XACT_E_TIP_DISABLED
Microsoft-Windows-MSDTC,,1073795108,0,,,,,During the MS DTC installation; the attempt to delete the dtclog directory failed. This was done since the location of the log directory has been changed to msdtc. This can happen if the dtclog directory is not empty. Internal Information : {param1}.
Microsoft-Windows-MSDTC,,2147536932,0,,,,,The XA Transaction Manager attempted to load the XA resource manager DLL. The call to LOADLIBRARY for the XA resource manager DLL failed: DLL={param1}; HR={param4}; File={param2} Line={param3}.
Microsoft-Windows-MSDTC,,3221278756,0,,,,,XACT_E_NETWORK_TX_DISABLED
